"Header.Sachgebiete";"DES.Term(1)";"DES.Term(2)";"DES.Term(3)";"ENG.Term(1)";"ENG.Term(2)";"ENG.Term(3)";"FRS.Term(1)";"FRS.Term(2)";"FRS.Term(3)";"ITS.Term(1)";"ITS.Term(2)";"ITS.Term(3)"
"Entwicklung und Zusammenarbeit";"ESG-Risiken";"Risiken für Umwelt, Soziales und Unternehmensführung";"";"environmental, social and governance risks";"ESG risks";"";"risques environnementaux, sociaux et de gouvernance";"risques ESG";"";"";"rischi ambientali, sociali e di governance";""
"Frieden und Sicherheit; Recht";"Ständiger Schiedshof";"";"";"";"Permanent Court of Arbitration";"";"Cour permanente d'arbitrage";"";"";"Corte permanente d'arbitrato";"";""
"Entwicklung und Zusammenarbeit";"";"Forum für Entwicklungszusammenarbeit";"";"";"Development Cooperation Forum";"";"Forum pour la coopération en matière de développement";"";"";"";"Forum per la cooperazione allo sviluppo";""
"Entwicklung und Zusammenarbeit; Politik; Struktur und Institution";"Dezentralisierung";"";"";"decentralisation";"";"";"décentralisation";"";"";"decentralizzazione";"decentramento";""
"Reduktion von Katastrophenrisiken";"Nachbeben";"";"";"aftershock";"";"";"réplique";"";"";"replica";"scossa di assestamento";""
"Entwicklung und Zusammenarbeit";"humanitäre Notlage";"";"";"humanitarian emergency";"";"";"situation d’urgence humanitaire";"";"";"emergenza umanitaria";"";""
"Entwicklung und Zusammenarbeit; Landwirtschaft und Ernährung";"verborgener Hunger";"versteckter Hunger";"";"hidden hunger";"";"";"faim cachée";"";"";"fame nascosta";"";""
"Sicherheit";"klassifizieren";"";"";"classify";"";"";"classifier";"";"";"classificare";"";""
"Wissenschaft und Technologie";"Weltraumschrott";"";"";"space debris";"space junk";"space pollution";"débris spatiaux";"";"";"detrito orbitale";"detrito spaziale";"relitto spaziale"
"Politik; Wissenschaft und Technologie";"Weltraumpolitik";"";"";"space policy";"";"";"politique spatiale";"";"";"politica spaziale";"";""
"Entwicklung und Zusammenarbeit; Wirtschaft und Finanzen";"";"multilaterale Entwicklungsbank";"";"";"multilateral development bank";"";"banque multilatérale de développement";"";"";"banca multilaterale di sviluppo";"";""
"Humanitäre Hilfe";"Glückskette";"";"";"Swiss Solidarity";"";"";"Chaîne du bonheur";"";"";"Catena della Solidarietà";"";""
"Humanitäre Hilfe";"komplexe humanitäre Notlage";"komplexe humanitäre Notsituation";"";"";"complex humanitarian emergency";"";"situation d’urgence humanitaire complexe";"";"";"emergenza umanitaria complessa";"";""
"Entwicklung und Zusammenarbeit; Politik";"zivil-militärische Zusammenarbeit";"";"";"";"civil-military cooperation";"";"coopération civilo-militaire";"";"";"collaborazione tra settore civile e settore militare";"cooperazione civile-militare";""
"Konsularische Angelegenheiten; Recht";"Entlassung";"";"";"relief of citizenship";"relief of Swiss citizenship";"";"libération";"";"";"svincolo";"";""
"Bildung; Wissenschaft und Technologie";"Community of Practice";"CoP";"praxisbezogene Gemeinschaft";"community of practice";"CoP";"";"communauté de pratique";"";"";"community di pratica";"";""
"Konsularische Angelegenheiten; Recht";"Entlassungsurkunde";"";"";"certificate of relief of citizenship";"";"";"acte de libération";"";"";"atto di svincolo";"";""
"Frieden und Sicherheit; Recht";"Versöhnungskommission";"";"";"reconciliation commission";"";"";"commission de réconciliation";"";"";"commissione per la riconciliazione";"";""
"Entwicklung und Zusammenarbeit";"Koordinatorinnen- und Koordinatorenseminar";"";"";"coordinators seminar";"";"";"";"séminaire des coordinateurs";"";"";"seminario delle coordinatrici e dei coordinatori";""
"Entwicklung und Zusammenarbeit; Struktur und Institution; Wissenschaft und Technologie";"Indo-Swiss Collaboration in Biotechnology";"";"";"Indo-Swiss Collaboration in Biotechnology";"";"";"Collaboration indo-suisse en biotechnologie";"";"";"Collaborazione indo-svizzera nelle biotecnologie";"";""
"Energie und Umwelt; Entwicklung und Zusammenarbeit; Struktur und Institution";"Umwelt- und Sozialrahmen";"";"";"Environmental and Social Framework";"";"";"Cadre environnemental et social";"";"";"quadro ambientale e sociale";"";""
"HR; Struktur und Institution";"HR-B DV/KV";"HR-Beratung Diplomatische und Konsularische Aufgaben";"";"HR Advisory Service Diplomatic and Consular Tasks";"HR AS DV/KV";"";"C-RH DV/KV";"Conseil RH Fonctions diplomatiques et consulaires";"";"Cons RU DV/KV";"Consulenza RU Compiti diplomatici e consolari";""
"HR; Struktur und Institution";"HR-B IZA";"HR-Beratung Internationale Zusammenarbeit";"";"HR Advisory Service International Cooperation";"HR AS IC";"";"C-RH CI";"Conseil RH Coopération internationale";"";"Cons RU CI";"Consulenza RU Cooperazione internazionale";""
"HR; Struktur und Institution";"HR-B AN";"HR-Beratung Allgemeine Dienste";"";"HR Advisory Service General Services";"HR AS GS";"";"C-RH SG";"Conseil RH Services généraux";"";"Cons RU SG";"Consulenza RU Servizi generali";""
"HR; Struktur und Institution";"HR-Admin";"HR-Administration";"";"HR Admin";"HR Administration";"";"Admin RH";"Administration RH";"";"Ammin RU";"Amministrazione RU";""
"HR; Struktur und Institution";"HR-B LHP";"HR-Beratung Lokal- und Honorarpersonal";"";"HR Advisory Service Local and Honorary Personnel";"HR AS LHP";"";"C-RH PLH";"Conseil RH Personnel local et personnel honoraire";"";"Cons RU PLO";"Consulenza RU Personale locale e personale onorario";""
"Informatik und Telekommunikation";"Arbeitsplatz";"";"";"workstation";"";"";"poste de travail";"";"";"postazione di lavoro";"";""
"Informatik und Telekommunikation";"";"Arbeitsplatzsystem";"";"workstation system";"";"";"";"système de poste de travail";"";"sistema di postazioni di lavoro";"";""
"Diplomatie und Protokoll; Geschäftsverwaltung; Struktur und Institution";"Stiftungsrat";"";"";"Foundation Council";"";"";"conseil de fondation";"";"";"Consiglio di fondazione";"";""
"Sicherheit";"Fonds für die innere Sicherheit";"";"";"Internal Security Fund";"";"";"Fonds pour la sécurité intérieure";"";"";"Fondo sicurezza interna";"";""
"Migration; Sicherheit";"Aussengrenzenfonds";"";"";"External Borders Fund";"";"";"Fonds pour les frontières extérieures";"";"";"Fondo per le frontiere esterne";"";""
"Migration; Sicherheit";"";"Asyl-, Migrations- und Integrationsfonds";"";"";"Asylum, Migration and Integration Fund";"";"";"Fonds « Asile, migration et intégration »";"";"";"";"Fondo Asilo, migrazione e integrazione"
"Frieden und Sicherheit; Humanitäre Hilfe; Menschenrechte; Migration; Reduktion von Katastrophenrisiken; Struktur und Institution";"Stiftungsrat";"";"";"Foundation Board";"";"";"Conseil de fondation";"";"";"Consiglio di fondazione";"";""
"Menschenrechte; Struktur und Institution; Humanitäre Hilfe";"";"Unterausschuss zur Verhütung von Folter und anderer grausamer, unmenschlicher oder erniedrigender Behandlung oder Strafe";"Unterausschuss zur Verhütung von Folter";"";"Subcommittee on Prevention of Torture and other Cruel, Inhuman or Degrading Treatment or Punishment";"Subcommittee on Prevention of Torture";"Sous-Comité pour la prévention de la torture et autres peines ou traitements cruels, inhumains ou dégradants";"Sous-Comité pour la prévention de la torture";"";"Sottocomitato per la prevenzione della tortura e di altre pene o trattamenti crudeli, inumani o degradanti";"Sottocomitato per la prevenzione della tortura";""
"Buchhaltung";"Kontierung";"";"";"account assignment";"";"";"comptabilisation";"";"";"contabilizzazione";"";""
"Entwicklung und Zusammenarbeit";"Verpflichtungsperiode";"Verpflichtungszeitraum";"";"commitment period";"";"";"période d’engagement";"";"";"periodo d'impegno";"";""
"Politik; Struktur und Institution";"";"Golf-Kooperationsrat";"Kooperationsrat der Arabischen Golfstaaten";"Cooperation Council for the Arab States of the Gulf";"";"Gulf Cooperation Council";"";"Conseil de coopération des États arabes du Golfe";"Conseil de coopération du Golfe";"";"Consiglio di cooperazione degli Stati Arabi del Golfo";"Consiglio di cooperazione del Golfo"
"Diplomatie und Protokoll";"Boko";"Botschafter- und Aussennetzkonferenz";"Botschafterkonferenz";"Ambassadors and International Network Conference";"Ambassadors' Conference";"";"Conférence des ambassadeurs";"Conférence des ambassadeurs et du réseau extérieur";"";"Conferenza degli ambasciatori";"Conferenza degli ambasciatori e della rete esterna";""
"Frieden und Sicherheit";"";"";"";"";"";"";"";"";"";"";"";""
"Recht";"Wiener Übereinkommen über konsularische Beziehungen";"WÜK";"";"Vienna Convention on Consular Relations";"";"";"Convention de Vienne sur les relations consulaires";"";"";"Convenzione di Vienna sulle relazioni consolari";"";""
"Sicherheit";"Prümer Zusammenarbeit";"";"";"Prüm cooperation";"";"";"coopération Prüm";"";"";"cooperazione Prüm";"";""
"Energie und Umwelt; Kultur; Verkehr";"Soirée Suisse";"";"";"Soirée Suisse";"";"";"Soirée suisse";"";"";"Soirée Suisse";"";""
"Diplomatie und Protokoll";"High-Level-Woche";"hochrangige Woche";"";"high-level week";"";"";"semaine de haut niveau";"";"";"settimana ad alto livello";"";""
"Entwicklung und Zusammenarbeit; Gesundheit";"nicht verbesserte sanitäre Einrichtung";"";"";"unimproved sanitation facility";"";"";"installation d'assainissement non améliorée";"installation sanitaire non améliorée";"";"installazione sanitaria non migliorata";"";""
"Entwicklung und Zusammenarbeit; Kultur; Landwirtschaft und Ernährung";"Comptoir Suisse";"";"";"Comptoir Suisse";"";"";"Comptoir Suisse";"";"";"Comptoir Suisse";"";""
"Diplomatie und Protokoll; Entwicklung und Zusammenarbeit; Migration; Politik; Struktur und Institution";"Schweizerische Gesellschaft für Aussenpolitik";"";"";"Swiss Foreign Policy Society";"";"";"";"Association suisse de politique étrangère";"";"Associazione svizzera di politica estera";"";""
"Migration";"Asyl-Shopping";"Asylshopping";"Asyltourismus";"asylum shopping";"";"";"shopping d'asile";"tourisme d'asile";"";"shopping dell’asilo";"turismo dell'asilo";""
"Entwicklung und Zusammenarbeit";"am wenigsten entwickelte Länder";"";"LDCs";"LDCs";"least developed countries";"";"pays les moins avancés";"";"";"Paesi meno avanzati";"";""
"Diplomatie und Protokoll; Struktur und Institution";"funktionales System";"";"";"function-based system";"";"";"système fonctionnel";"";"";"sistema basato sulla funzione occupata";"sistema funzionale";""
"Buchhaltung; Geschäftsverwaltung; Wirtschaft und Finanzen";"Anlagenbuchhaltung";"FI-AA";"";"asset accounting";"asset accounting system";"";"comptabilité des immobilisations";"";"";"gestione cespiti";"";""
"Energie und Umwelt; Landwirtschaft und Ernährung; Politik; Recht";"Abkommen zwischen der Schweizerischen Eidgenossenschaft und der Europäischen Gemeinschaft über die Beteiligung der Schweiz an der Europäischen Umweltagentur und dem Europäischen Umweltinformations- und Umweltbeobachtungsnetz";"Umweltabkommen";"";"Agreement between the European Community and the Swiss Confederation concerning the participation of Switzerland in the European Environment Agency and the European Environment Information and Observation Network";"Environment Agreement";"";"Accord entre la Confédération suisse et la Communauté européenne concernant la participation de la Suisse à l'Agence européenne pour l'environnement et au réseau européen d'information et d'observation pour l'environnement";"accord sur l’environnement";"";"Accordo in materia ambientale";"Accordo tra la Confederazione Svizzera e la Comunità europea sulla partecipazione della Svizzera all'Agenzia europea dell'ambiente e alla rete europea d'informazione e di osservazione in materia ambientale";""
"Entwicklung und Zusammenarbeit; Struktur und Institution";"Association of European Parliamentarians with Africa";"";"Vereinigung europäischer Parlamentarier für Afrika";"Association of European Parliamentarians with Africa";"";"";"Association des parlementaires européens partenaires de l’Afrique";"";"";"Associazione dei parlamentari europei per l’Africa";"";""
"Menschenrechte; Recht";"Menschenrechtsvertragsorgan";"Vertragsorgan";"";"human rights treaty body";"treaty body";"treaty-based body";"organe de traité";"organe de traité sur les droits de l'homme";"";"organi dei trattati";"organo istituito da trattati";""
"Menschenrechte; Recht";"Menschenrechtsgremium";"Menschenrechtsorgan";"";"human rights body";"";"";"organe chargé des droits de l’homme";"organe des droits de l'homme";"";"organo specializzato in materia di diritti umani";"organo specializzato nei diritti umani";""
"Politik";"Binnenentwicklungsland";"";"";"landlocked developing country";"";"";"pays en développement sans littoral";"";"";"paese in via di sviluppo senza sbocco sul mare";"paese in via di sviluppo senza sbocco al mare";""
"Migration";"lang andauernde Flüchtlingssituation";"";"";"protracted refugee situation";"";"";"situation de réfugié prolongée";"";"";"situazione di rifugiato prolungata";"";""
"Entwicklung und Zusammenarbeit; Humanitäre Hilfe";"";"Verknüpfung von Soforthilfe, Rehabilitation und Entwicklung";"";"linking relief, rehabilitation and development";"";"";"";"liens entre l'aide d'urgence, la réhabilitation et le développement";"";"";"collegamento tra aiuto, risanamento e sviluppo";"collegare l'aiuto, il risanamento e lo sviluppo"
"Recht";"Beschlagnahmung";"Einziehung";"";"confiscation";"forfeiture";"";"confiscation";"";"";"confisca";"";""
"Migration; Struktur und Institution";"UNO-Gipfel für Flüchtlinge und Migranten";"";"";"United Nations Summit for Refugees and Migrants";"";"";"Sommet des Nations Unies pour les réfugiés et les migrants";"";"";"Vertice delle Nazioni Unite sui rifugiati e i migranti";"";""
"HR";"";"Bochumer Inventar zur berufsbezogenen Persönlichkeitsbeschreibung";"";"";"Business-Focused Inventory of Personality";"";"";"inventaire de personnalité de Bochum dans le contexte professionnel";"";"";"Inventario di Bochum per la descrizione della personalità nell'ambito professionale";""
"Andere";"Grossbritannien";"Vereinigtes Königreich";"Vereinigtes Königreich von Grossbritannien und Nordirland";"United Kingdom";"United Kingdom of Great Britain and Northern Ireland";"";"Grande-Bretagne";"Royaume-Uni";"Royaume-Uni de Grande-Bretagne et d'Irlande du Nord";"Gran Bretagna";"Regno Unito";"Regno Unito della Gran Bretagna e dell'Irlanda del Nord"
"Diplomatie und Protokoll; Frieden und Sicherheit";"Konfliktprävention";"";"";"conflict prevention";"";"";"prévention des conflits";"";"";"prevenzione dei conflitti";"";""
"Landwirtschaft und Ernährung";"Suone";"";"";"bisse";"suone";"";"bisse";"";"";"roggia";"";""
"Struktur und Institution";"Sektion Asset Recovery";"";"";"Asset Recovery";"";"";"Section de la restitution d'avoirs illicites";"";"";"Sezione Restituzione di averi di provenienza illecita";"";""
"Diplomatie und Protokoll; HR";"Diplomatischer Berater des EDA-Vorstehers für spezielle Aufgaben";"";"";"diplomatic adviser to the head of the FDFA for special tasks";"";"";"conseiller diplomatique pour missions spéciales du chef du DFAE";"";"";"Consulente diplomatico del capo del DFAE per compiti speciali";"";""
"Frieden und Sicherheit; Migration";"Push-Faktor";"";"";"push factor";"";"";"facteur de répulsion";"";"";"fattore push";"";""
"Recht";"auslegende Erklärung";"interpretative Erklärung";"";"interpretative declaration";"interpretative statement";"";"déclaration interprétative";"";"";"dichiarazione interpretativa";"";""
"HR";"Fachkompetenzen";"";"";"professional competencies";"specialist competencies";"";"compétences spécialisées";"";"";"competenze professionali";"competenze specialistiche";""
"HR";"Methodenkompetenzen";"";"";"methodology competencies";"";"";"compétences méthodologiques";"";"";"competenze metodologiche";"";""
"Gesundheit";"antimikrobielle Resistenz";"";"";"";"antimicrobial resistance";"";"résistance aux antimicrobiens";"";"";"";"resistenza antimicrobica";""
"Gender; Humanitäre Hilfe; Menschenrechte; Migration";"Nationaler Aktionsplan gegen Menschenhandel";"";"";"National Action Plan to Fight Human Trafficking";"";"";"Plan d'action national contre la traite des êtres humains";"";"";"Piano nazionale d'azione contro la tratta di esseri umani";"";""
"Informatik und Telekommunikation; Konsularische Angelegenheiten";"Online-Schalter";"virtueller Schalter";"";"online desk";"";"";"guichet en ligne";"";"";"sportello online";"sportello virtuale";""
"Politik; Recht";"Observatorium zum Freizügigkeitsabkommen Schweiz-EU";"";"";"Observatory for the Swiss-EU Agreement on the Free Movement of Persons";"";"";"Observatoire sur la libre circulation des personnes entre la Suisse et l’UE";"";"";"Osservatorio sulla libera circolazione delle persone tra Svizzera e UE";"";""
"Struktur und Institution";"Qualitätssicherung und Armutsreduktion";"";"";"Quality Assurance and Poverty Reduction";"";"";"Assurance qualité et réduction de la pauvreté";"";"";"Assicurazione qualità e riduzione della povertà";"";""
"Diplomatie und Protokoll; HR";"Direktor der Politischen Direktion";"Politischer Direktor";"";"head of the Directorate of Political Affairs";"";"";"directeur de la Direction politique";"";"";"direttore della Direzione politica";"direttore politico";""
"Frieden und Sicherheit; Politik; Sicherheit";"Prümer Beschluss";"";"";"Prüm Decision";"";"";"décision Prüm";"";"";"decisione di Prüm";"";""
"Frieden und Sicherheit; Migration";"Pull-Faktor";"";"";"pull factor";"";"";"facteur d'attraction";"";"";"fattore pull";"";""
"HR; Struktur und Institution";"Direktor";"";"";"director general";"";"";"directeur";"";"";"direttore";"";""
"Buchhaltung; HR; Struktur und Institution; Konsularische Angelegenheiten";"";"Chef Finanzen, Personal und Administration";"";"";"head of finance, HR and administration";"";"";"chef Finances, personnel et administration";"";"capo Finanze, personale, amministrazione";"";""
"Menschenrechte; Struktur und Institution";"Implementierungstreffen der menschlichen Dimension";"";"";"Human Dimension Implementation Meeting";"";"";"Conférence d’examen sur la dimension humaine";"";"";"Incontro sull'implementazione della dimensione umana";"";""
"Entwicklung und Zusammenarbeit";"aggregierbarer Referenzindikator";"";"";"aggregated reference indicator";"";"";"";"indicateur de référence agrégé";"";"";"";""
"Frieden und Sicherheit";"Zollexperte";"";"";"customs expert";"";"";"expert de douanes";"expert en douane";"";"esperto in materia di dogane";"";""
"Frieden und Sicherheit";"Polizeiexperte";"";"";"police expert";"";"";"expert de police";"";"";"esperto in materia di polizia";"";""
"Bildung";"";"frühkindliche Betreuung, Bildung und Erziehung";"";"early childhood education and care";"";"";"";"éducation et accueil des jeunes enfants";"";"";"educazione e cura della prima infanzia";""
"Entwicklung und Zusammenarbeit; Humanitäre Hilfe; Reduktion von Katastrophenrisiken";"Internationaler Tag der Katastrophenvorbeugung";"";"";"International Day for Disaster Reduction";"";"";"Journée internationale de la prévention des catastrophes";"";"";"Giornata internazionale per la riduzione dei disastri naturali";"Giornata internazionale per la prevenzione delle catastrofi";"Giornata mondiale per la riduzione dei disastri naturali"
"Konsularische Angelegenheiten; Sicherheit; Struktur und Institution";"Polizeiattaché";"";"";"police attaché";"";"";"attaché de police";"";"";"addetto di polizia";"";""
"Diplomatie und Protokoll; Migration; Struktur und Institution";"Migrationsattaché";"";"";"immigration attaché";"migration attaché";"";"attaché migratoire";"";"";"addetto per la migrazione";"";""
"Entwicklung und Zusammenarbeit";"Auswirkung";"";"";"outcome";"";"";"effet attendu";"effet direct";"outcome";"esito";"";""
"Entwicklung und Zusammenarbeit";"Leistungen";"Outputs";"Produkte";"output";"";"";"extrants";"produits";"";"realizzazioni";"";""
"Entwicklung und Zusammenarbeit";"Monitoring";"";"";"monitoring";"";"";"monitoring";"suivi";"";"monitoraggio";"monitoring";""
"Entwicklung und Zusammenarbeit";"Inputs";"";"";"input";"";"";"inputs";"intrants";"";"input";"";""
"Entwicklung und Zusammenarbeit";"Indikator";"";"";"indicator";"";"";"indicateur";"";"";"indicatore";"";""
"Entwicklung und Zusammenarbeit";"Wirkungsziel";"";"";"expected outcome";"";"";"objectif d'effets";"";"";"obiettivo d'efficacia";"";""
"Informatik und Telekommunikation";"hervorgehobenes Suchresultat";"";"";"promoted result";"";"";"meilleur résultat";"";"";"risultato in evidenza";"";""
"Frieden und Sicherheit; Struktur und Institution";"Exekutivrat";"";"";"Executive Council";"Executive Council of the Organisation for the Prohibition of Chemical Weapons";"";"Conseil exécutif";"";"";"Consiglio Esecutivo";"";""
"Wirtschaft und Finanzen";"einzuzahlendes Kapital";"einzuzahlendes Stammkapital";"";"paid-in capital";"";"";"capital libéré";"";"";"capitale versato";"versamento in contanti";""
"Frieden und Sicherheit";"Bericht des Bundesrates über die Rüstungskontroll- und Abrüstungspolitik der Schweiz";"";"";"Federal Council report on Switzerland’s arms control and disarmament policy";"";"";"rapport du Conseil fédéral sur la politique de la Suisse en matière de maîtrise des armements et de désarmement";"";"";"Rapporto del Consiglio federale sulla politica di controllo degli armamenti e di disarmo della Svizzera";"";""
"Entwicklung und Zusammenarbeit; Struktur und Institution";"Beratungsausschuss";"";"";"Advisory Commission";"";"";"commission consultative";"";"";"Commissione Consultiva";"";""
"Kultur; Struktur und Institution";"Welterbekomitee";"";"";"World Heritage Committee";"";"";"Comité du patrimoine mondial";"";"";"Comitato del Patrimonio mondiale";"";""
"Entwicklung und Zusammenarbeit";"Erweiterungsbeitrag";"Schweizer Beitrag an die erweiterte EU";"";"enlargement contribution";"Switzerland's contribution to the enlarged EU";"";"contribution de la Suisse à l'UE élargie";"";"";"contributo all'allargamento";"contributo svizzero all'Unione europea allargata";""
"Entwicklung und Zusammenarbeit";"Kernbeitrag";"";"";"core contribution";"";"";"contribution de base";"";"";"contributo alle spese generali";"contributo principale";""
"Diplomatie und Protokoll; Konsularische Angelegenheiten; Tourismus";"Délégation culturelle et économique de Taipei";"Kultur- und Wirtschaftsdelegation Taipeh";"";"Taipei Cultural and Economic Delegation";"";"";"Délégation culturelle et économique de Taipei";"";"";"";"";""
"Entwicklung und Zusammenarbeit";"Dialog 2030 für nachhaltige Entwicklung";"";"";"2030 Dialogue for Sustainable Development";"";"";"Dialogue 2030 pour le développement durable";"";"";"Dialogo 2030 per uno sviluppo sostenibile";"";""
"Recht; Struktur und Institution";"";"Interdepartementales Komitee für humanitäres Völkerrecht";"";"";"Interdepartmental Committee for International Humanitarian Law";"";"";"Comité interdépartemental de droit international humanitaire";"";"Comitato interdipartimentale per il diritto internazionale umanitario";"";""
"Recht; Struktur und Institution";"unabhängige internationale Untersuchungskommission";"";"";"international independent investigation commission";"";"";"commission d’enquête internationale indépendante";"";"";"commissione internazionale indipendente d’inchiesta";"";""
"Entwicklung und Zusammenarbeit";"Core Contribution Management";"ergebnisorientiertes Management von Kernbeiträgen";"";"core contribution management";"";"";"";"core contribution management";"gestion axée sur les résultats des contributions générales";"";"Core Contribution Management";""
"Frieden und Sicherheit";"Herabsetzung der Einsatzbereitschaft von Nuklearwaffen";"";"";"de-alerting";"";"";"retrait de l’état d’alerte des armes nucléaires";"";"";"de-alerting";"riduzione del livello di disponibilità delle armi nucleari";""
"Struktur und Institution";"Geschäftsleitung";"";"";"management";"";"";"direction";"";"";"direzione";"";""
"Landwirtschaft und Ernährung; Recht";"Freiwillige Leitlinien für die verantwortungsvolle Regulierung von Eigentums-, Besitz- und Nutzungsrechten an Land, Fischgründen und Wäldern im Rahmen nationaler Ernährungssicherheit";"";"";"";"Voluntary Guidelines on the Responsible Governance of Tenure of Land, Fisheries and Forests in the Context of National Food Security";"";"Directives volontaires pour une gouvernance responsable des régimes fonciers applicables aux terres, aux pêches et aux forêts dans le contexte de la sécurité alimentaire nationale";"";"";"Direttive volontarie per una governance responsabile dei regimi di proprietà applicabili alla terra, alla pesca e alle foreste nel contesto della sicurezza alimentare nazionale";"";""
"Entwicklung und Zusammenarbeit; Frieden und Sicherheit; Gesundheit; Landwirtschaft und Ernährung; Politik";"Rahmen globaler Indikatoren";"";"";"global indicator framework";"";"";"cadre mondial d’indicateurs";"";"";"quadro globale di indicatori";"";""
"Gesundheit";"";"Wasser, sanitäre Anlagen und Hygiene";"Wasser, Sanitärversorgung und Hygiene";"";"water, sanitation and hygiene";"";"eau, assainissement et hygiène";"eau, assainissement et santé";"";"acqua, impianti sanitari e igiene";"";""
"Diplomatie und Protokoll; Konsularische Angelegenheiten";"hoher Empfänger";"";"";"high addressee";"";"";"haut destinataire";"";"";"alto destinatario";"";""
"Recht";"monistisches System";"";"";"monist legal system";"monist system";"";"système moniste";"";"";"sistema monistico";"";""
"Struktur und Institution";"Schweizer Verein im Fürstentum Liechtenstein";"";"";"Swiss Association in the Principality of Liechtenstein";"";"";"Association suisse dans la Principauté de Liechtenstein";"";"";"Associazione svizzera del Liechtenstein";"";""
