"Header.Sachgebiete";"DES.Term(1)";"DES.Term(2)";"DES.Term(3)";"ENG.Term(1)";"ENG.Term(2)";"ENG.Term(3)";"FRS.Term(1)";"FRS.Term(2)";"FRS.Term(3)";"ITS.Term(1)";"ITS.Term(2)";"ITS.Term(3)"
"Migration";"Khartum-Prozess";"Migrationsrouten-Initiative EU–Horn von Afrika";"";"Khartoum Process";"";"";"Processus de Khartoum";"";"";"iniziativa UE-Corno d'Africa in materia di rotte migratorie";"Processo di Khartoum";""
"Migration";"Rabat-Prozess";"";"";"Rabat Process";"";"";"Processus de Rabat";"";"";"Processo di Rabat";"";""
"Wissenschaft und Technologie";"Tech for Good";"Tech4Good";"";"tech for good";"Tech4Good";"";"tech for good";"Tech4Good";"";"tech for good";"Tech4Good";""
"Landwirtschaft und Ernährung; Wissenschaft und Technologie";"Foodtech";"";"";"foodtech";"";"";"foodtech";"technologies alimentaires";"";"foodtech";"tecnologia alimentare";""
"Diplomatie und Protokoll; Politik; Struktur und Institution";"vereinbarte Sprachregelungen";"vereinbarter Text";"";"agreed language";"";"";"langage concerté";"";"";"linguaggio concordato";"";""
"Arbeit und Beschäftigung; Sicherheit";"Richtlinie zum aufgeräumten Arbeitsplatz und leeren Bildschirm";"";"";"clear desk and clear screen policy";"";"";"politique du bureau propre et de l’écran vide";"";"";"clear desk and clear screen policy";"politica della scrivania pulita e dello schermo pulito";""
"Diplomatie und Protokoll; HR";"Springerentschädigung";"";"";"stand-by allowance";"";"";"indemnité d'agent de renfort";"";"";"indennità per personale jolly";"";""
"Energie und Umwelt";"Kigali-Kühleffizienzprogramm";"";"";"K-CEP";"Kigali Cooling Efficiency Program";"";"Programme de Kigali pour l'efficacité des dispositifs de refroidissement";"";"";"Programma di Kigali per l'efficienza del raffreddamento";"";""
"Wirtschaft und Finanzen";"diagonale Ursprungskumulation";"diagonale Ursprungskumulierung";"";"diagonal cumulation of origin";"";"";"cumul diagonal de l’origine";"";"";"cumulo diagonale dell’origine";"";""
"Wirtschaft und Finanzen";"PEM-Übereinkommen";"Regionales Übereinkommen über Pan-Europa-Mittelmeer-Präferenzursprungsregeln";"";"Regional Convention on pan-Euro-Mediterranean preferential rules of origin";"";"";"convention paneuro-méditerranéenne";"Convention PEM";"Convention régionale sur les règles d’origine préférentielles paneuroméditerranéennes";"Convenzione PEM";"Convenzione regionale sulle norme di origine preferenziali paneuromediterranee";""
"Landwirtschaft und Ernährung; Wirtschaft und Finanzen";"gesundheitspolizeiliche und pflanzenschutzrechtliche Massnahme";"SPS-Massnahme";"";"sanitary and phytosanitary measure";"SPS measure";"";"mesure sanitaire et phytosanitaire";"mesure SPS";"";"misura sanitaria e fitosanitaria";"misura SPS";""
"Wirtschaft und Finanzen";"grenzüberschreitende Dienstleistungserbringung";"";"";"cross-border provision of services";"cross-border service provision";"";"prestation de services transfrontalière";"prestation transfrontalière de services";"";"fornitura transfrontaliera di servizi";"prestazione transfrontaliera di servizi";""
"Diplomatie und Protokoll; Wirtschaft und Finanzen";"Memorandum of Understanding zur Entwicklung der Kooperation in Drittmärkten";"";"";"Memorandum of Understanding on Developing Third-Party Market Cooperation";"";"";"protocole d’entente concernant la coopération sur les marchés tiers";"";"";"memorandum d’intesa sullo sviluppo della cooperazione nei mercati terzi";"";""
"Wirtschaft und Finanzen";"Marktzugangshindernis";"";"";"barrier to market access";"market access barrier";"obstacle to market access";"entrave à l’accès au marché";"obstacle à l'accès du marché";"";"ostacolo all’accesso al mercato";"";""
"Recht";"Vormaterial ohne Ursprungseigenschaft";"";"";"non-originating material";"";"";"matière non originaire";"";"";"materiale non originario";"";""
"Andere";"Rätoromanisch: ein starkes Stück Schweiz";"";"";"Romansh: an essential part of Switzerland";"";"";"le romanche : un élément fort de la Suisse";"";"";"romancio: un tassello essenziale della Svizzera";"";""
"Struktur und Institution";"Projekt «Rebalancing»";"";"";"Rebalancing project";"";"";"projet de rééquilibrage des ressources";"";"";"progetto «Riequilibrio»";"";""
"Bildung; Energie und Umwelt; Wissenschaft und Technologie";"";"Zentrum für internationale Waldforschung";"";"Center for International Forestry Research";"";"";"Centre de recherche forestière internationale";"";"";"Centro internazionale per la ricerca forestale";"Centro per la ricerca forestale internazionale";""
"Buchhaltung; Wirtschaft und Finanzen";"internationales Rahmenkonzept für die integrierte Berichterstattung";"";"";"International Integrated Reporting Framework";"";"";"cadre de référence international portant sur le reporting intégré";"";"";"framework internazionale sul reporting integrato";"";""
"Landwirtschaft und Ernährung";"vertikale Landwirtschaft";"";"";"vertical agriculture";"vertical farming";"";"agriculture verticale";"";"";"agricoltura verticale";"";""
"Landwirtschaft und Ernährung";"vertikale Farm";"";"";"farmscraper";"vertical farm";"";"ferme verticale";"";"";"fattoria verticale";"";""
"HR";"Johari-Fenster";"";"";"Johari window";"";"";"fenêtre de Johari";"";"";"finestra di Johari";"";""
"Informatik und Telekommunikation";"PoLP";"Prinzip der geringsten Berechtigung";"Prinzip der geringsten Privilegien";"";"principle of least privilege";"";"principe du droit d'accès minimal";"principe du moindre privilège";"";"PoLP";"principio del privilegio minimo";"principio di minima autorità"
"Entwicklung und Zusammenarbeit";"Policy Marker";"";"";"policy marker";"";"";"marqueur de politique";"policy marker";"";"policy marker";"";""
"Diplomatie und Protokoll; Migration; Politik";"Migrationsdiplomatie";"";"";"migration diplomacy";"";"";"diplomatie des migrations";"diplomatie migratoire";"";"diplomazia migratoria";"";""
"Beschaffungswesen; Entwicklung und Zusammenarbeit";"Zulassungsprüfung";"";"";"eligibility clearance";"";"";"processus d’éligibilité";"";"";"esame dell’ammissibilità";"";""
"Arbeit und Beschäftigung; Politik";"öffentliche Arbeitsverwaltung";"";"";"public employment service";"";"";"service public de l'emploi";"";"";"servizio pubblico per l'impiego";"";""
"Gender; Menschenrechte";"Frauendekade der Vereinten Nationen";"";"";"United Nations Decade for Women";"";"";"Décennie des Nations Unies pour la femme";"";"";"decennio delle Nazioni Unite per la donna";"";""
"Recht";"abschreckende Wirkung";"Abschreckungseffekt";"";"chilling effect";"";"";"effet dissuasif";"effet paralysant";"";"effetto deterrente";"effetto dissuasivo";""
"Gender; Struktur und Institution";"Interdisziplinäres Zentrum für Geschlechterforschung";"";"";"";"Interdisciplinary Centre for Gender Studies";"";"Centre interdisciplinaire d’études genre";"";"";"Centro interdisciplinare per gli studi di genere";"";""
"Arbeit und Beschäftigung";"Vertragsstatus";"";"";"contractual status";"";"";"statut contractuel";"";"";"statuto contrattuale";"";""
"Recht; Wirtschaft und Finanzen";"Arbeitsgruppe der OECD für Bestechungsfragen im internationalen Geschäftsverkehr";"OECD-Arbeitsgruppe für Bestechungsfragen";"";"OECD Working Group on Bribery";"OECD Working Group on Bribery in International Business Transactions";"";"Groupe de travail de l'OCDE sur la corruption";"Groupe de travail sur la corruption dans le cadre des transactions commerciales internationales de l’OCDE";"";"Gruppo di lavoro dell'OCSE sulla corruzione";"Gruppo di lavoro dell’OCSE sulla corruzione nelle operazioni economiche inter­nazionali";""
"Frieden und Sicherheit; Politik";"Libysches Forum für politischen Dialog";"";"";"Libyan Political Dialogue Forum";"";"";"";"Forum du dialogue politique libyen";"";"Forum di dialogo politico libico";"";""
"Sicherheit";"System für die Validierung der Waffen- und Munitionsverwaltung";"";"";"system for the validation of arms and ammunition management";"";"";"système de validation de la gestion des armes et des munitions";"";"";"sistema di convalida della gestione di armi e munizioni";"";""
"Entwicklung und Zusammenarbeit; Gesundheit; Struktur und Institution";"";"Globale Partnerschaft für Antibiotikaforschung und -entwicklung";"";"";"Global Antibiotic Research and Development Partnership";"";"";"Partenariat mondial sur la recherche-développement en matière d’antibiotiques";"";"";"Partenariato globale per la ricerca e lo sviluppo di antibiotici";""
"Wirtschaft und Finanzen";"Marktkonzentration";"";"";"market concentration";"";"";"concentration du marché";"";"";"concentrazione del mercato";"";""
"Arbeit und Beschäftigung; Diplomatie und Protokoll; Entwicklung und Zusammenarbeit";"Abkommen über die Zusammenarbeit in Arbeits- und Beschäftigungsfragen";"";"";"Agreement on Labour and Employment Cooperation";"";"";"accord sur la coopération en matière de travail et d'emploi";"";"";"Accordo sulla cooperazione in materia di lavoro e di occupazione";"";""
"Energie und Umwelt; Entwicklung und Zusammenarbeit";"Weltwassertag";"";"";"World Water Day";"";"";"Journée mondiale de l'eau";"";"";"Giornata mondiale dell'acqua";"";""
"Entwicklung und Zusammenarbeit; Frieden und Sicherheit; Sicherheit; Struktur und Institution";"Länderteam";"";"";"";"United Nations country team";"";"équipe de pays";"";"";"country team dell'ONU";"";""
"Diplomatie und Protokoll; Entwicklung und Zusammenarbeit";"innovative strategische Partnerschaft";"";"";"innovative strategic partnership";"strategic innovative partnership";"";"partenariat stratégique innovateur";"";"";"partenariato strategico innovativo";"";""
"Struktur und Institution";"stellvertretender Staatssekretär";"";"";"deputy state secretary";"";"";"secrétaire d'État suppléant";"";"";"segretario di Stato supplente";"";""
"Diplomatie und Protokoll; Entwicklung und Zusammenarbeit";"China-Kompetenz";"";"";"China expertise";"";"";"expertise sur la Chine";"";"";"competenze sulla Cina";"";""
"Energie und Umwelt; Reduktion von Katastrophenrisiken";"Internationaler Tag der Wälder";"Internationaler Tag des Waldes";"";"International Day of Forests";"";"";"Journée internationale de la forêt";"Journée internationale des forêts";"";"Giornata internazionale delle foreste";"";""
"Entwicklung und Zusammenarbeit";"DAC-Arbeitsgruppe Evaluierung der Entwicklungszusammenarbeit";"";"";"DAC Working Party on Aid Evaluation";"WP-EV";"";"Groupe de travail du CAD sur l'évaluation de l'aide";"GT-EV";"";"Gruppo di lavoro Dac sulla valutazione";"Gruppo di lavoro sulla valutazione del Comitato aiuto allo sviluppo (Dac)";""
"Frieden und Sicherheit; Humanitäre Hilfe";"";"";"";"deconfliction";"humanitarian deconfliction";"";"déconfliction";"";"";"";"";""
"Menschenrechte; Politik; Recht";"Holocaust-Leugnung";"Leugnung des Holocaust";"";"Holocaust denial";"Holocaust revisionism";"";"négation de l’Holocauste";"négationnisme";"";"negazione dell'Olocausto";"negazionismo dell'Olocausto";""
"Gesundheit";"digitales Covid-Zertifikat der EU";"digitales COVID-Zertifikat der EU";"";"EU Digital COVID Certificate";"";"";"certificat COVID numérique de l'UE";"";"";"certificato COVID digitale dell'UE";"";""
"Energie und Umwelt; Kultur";"versunkene Kulturlandschaft";"";"";"submerged landscape";"";"";"paysage englouti";"";"";"paesaggio sommerso";"";""
"Energie und Umwelt; Landwirtschaft und Ernährung";"Hotspot der Biodiversität";"Hotspot der biologischen Vielfalt";"";"biodiversity hotspot";"";"";"haut lieu de la biodiversité";"hotspot de la biodiversité";"";"hotspot della biodiversità";"hotspot di biodiversità";""
"Sicherheit";"Beeinflussungsaktivität";"";"";"interference activity";"";"";"activité de prise d'influence";"";"";"attività di influenza";"";""
"Politik";"europäischer Gemeinschaftssinn";"";"";"European communality";"";"";"sens d'appartenance communautaire à l'Europe";"";"";"comunanza europea di interessi";"senso di appartenenza europea";""
"Sicherheit";"Führung und Krisenstabsorganisation";"";"";"crisis unit management and organisation";"";"";"commandement et organisation de la cellule de crise";"";"";"gestione e organizzazione dello Stato maggiore di crisi";"";""
"Recht";"IE/NI-Protokoll";"Protokoll zu Irland/Nordirland";"";"IE/NI Protocol";"Northern Ireland Protocol";"Protocol on Ireland/Northern Ireland";"protocole IE/NI";"protocole sur l'Irlande et l'Irlande du Nord";"";"protocollo IE/NI";"protocollo su Irlanda/Irlanda del Nord";""
"Entwicklung und Zusammenarbeit";"Fachdialog";"";"";"technical dialogue";"";"";"dialogue technique";"";"";"dialogo tecnico";"";""
"Diplomatie und Protokoll; Politik";"Aussenpolitik gestalten zu gleichen Teilen";"";"";"Shaping Foreign Policy in Equality";"";"";"Façonner la politique étrangère à parts égales";"";"";"Impostare la politica estera in parti uguali";"";""
"Politik; Struktur und Institution";"interdepartementale Arbeitsgruppe China";"Koordinationsausschuss China";"";"coordinating body for China";"interdepartmental working group on China";"";"comité de coordination pour la Chine";"groupe de travail interdépartemental sur la Chine";"";"comitato di coordinamento Cina";"gruppo di lavoro interdipartimentale sulla Cina";""
"Landwirtschaft und Ernährung; Struktur und Institution";"Schweizerisches Forum für internationale Agrarforschung";"";"";"";"Swiss Forum for International Agricultural Research";"";"Forum suisse pour la recherche agricole internationale";"";"";"Forum svizzero per la ricerca agraria internazionale";"";""
"Landwirtschaft und Ernährung; Struktur und Institution";"Gipfel für Ernährungssysteme";"Gipfeltreffen über Ernährungssysteme";"";"Food Systems Summit";"";"";"Sommet sur les systèmes alimentaires";"";"";"Vertice sui sistemi alimentari";"";""
"Sicherheit";"Management- und Informationsboard";"Managementboard";"";"crisis management board";"management board";"operations management board";"panneau de commandement";"tableau de gestion et d’information";"";"tabella di gestione";"";""
"Diplomatie und Protokoll";"Anlass zur Überreichung der Beglaubigungsschreiben";"";"";"ceremony for the presentation of credential letters";"credentials ceremony";"";"cérémonie de remise des lettres de créance";"";"";"cerimonia di consegna delle credenziali";"";""
"Gender";"Forum Generation Gleichberechtigung";"";"";"Generation Equality Forum";"";"";"Forum Génération Égalité";"";"";"forum Generazione uguaglianza";"";""
"Politik";"Ukraine-Reformkonferenz";"";"";"Ukraine Reform Conference";"";"";"Conférence sur les réformes en Ukraine";"";"";"Conferenza sulla riforma ucraina";"";""
"HR";"Sonderbotschafter für die Ukraine-Reformkonferenz in Bern";"";"";"special envoy to the Ukraine Reform Conference in Bern";"";"";"ambassadeur en mission spéciale pour l’organisation de la Conférence sur les réformes en Ukraine";"";"";"ambasciatore speciale per la conferenza sulla riforma ucraina a Berna";"";""
"Gesundheit";"Weltgesundheitstag";"";"";"World Health Day";"";"";"Journée mondiale de la santé";"";"";"Giornata mondiale della salute";"";""
"Gesundheit";"";"vernachlässigte Tropenkrankheiten";"";"neglected tropical diseases";"";"";"maladies tropicales négligées";"";"";"malattie tropicali neglette";"";""
"Gesundheit";"DNDi";"Drugs for Neglected Diseases initiative";"";"DNDi";"Drugs for Neglected Diseases initiative";"";"initiative Médicaments contre les maladies négligées";"";"";"DNDi";"Drugs for Neglected Diseases initiative";"Iniziativa per i farmaci contro le malattie neglette"
"Menschenrechte; Struktur und Institution";"Koordinationsstelle";"";"";"coordination service";"";"";"service de coordination";"";"";"servizio di coordinamento";"";""
"Entwicklung und Zusammenarbeit";"Triple Nexus";"";"";"development, humanitarian and peacebuilding nexus";"humanitarian-development-peace nexus";"nexus";"triple nexus";"";"";"triple nexus";"triplo nesso";""
"Bildung; Entwicklung und Zusammenarbeit; Landwirtschaft und Ernährung; Wissenschaft und Technologie";"";"Institut für Agrarwissenschaften";"";"";"Institute of Agricultural Sciences";"";"Institut des sciences agronomiques";"";"";"";"";""
"Entwicklung und Zusammenarbeit; Landwirtschaft und Ernährung";"";"Pan-African Bean Research Alliance";"Panafrikanische Bohnenforschungsallianz";"";"Pan-Africa Bean Research Alliance";"";"Alliance panafricaine de recherche sur le haricot";"";"";"Alleanza panafricana per la ricerca in materia di fagioli";"";""
"Gender";"W’sHR App";"Women’s Human Rights App";"";"W'sHR App";"Women's Human Rights App";"";"application Women’s Human Rights";"W'sHR app";"Women's Human Rights app";"app Women’s Human Rights";"W'sHR App";"Women’s Human Rights App"
"Konsularische Angelegenheiten";"Mystery Client";"Testantragstellende";"Testantragsteller";"mystery client";"test applicant";"";"client mystère";"demandeur-test";"";"Mystery Client";"persone che possono effettuare un test come richiedenti";""
"Energie und Umwelt; Wirtschaft und Finanzen";"Green Bond";"grüne Anleihe";"";"climate bond";"green bond";"";"obligation climat";"obligation climatique";"obligation verte";"Green Bond";"obbligazione verde";""
"Wirtschaft und Finanzen; Wissenschaft und Technologie";"Gemeinsame Erklärung zwischen der Volksrepublik China und der Schweizerischen Eidgenossenschaft zur Errichtung einer Innovativen Strategischen Partnerschaft";"";"";"Joint declaration between the People's Republic of China and the Swiss Confederation on the Establishment of an Innovative Strategic Partnership";"";"";"Déclaration commune de la République populaire de Chine et de la Confédération suisse concernant la mise en place d’un partenariat stratégique innovateur";"";"";"Dichiarazione congiunta tra la Repubblica popolare Cinese e la Confederazione Svizzera sull’istituzione di un partenariato strategico innovativo";"";""
"HR";"Entwicklungsprogramm ONE EDA";"EP ONE EDA";"";"ONE EDA development programme";"";"";"EP ONE EDA";"programme de développement ONE EDA";"";"Programma di sviluppo ONE EDA";"";""
"Energie und Umwelt; Landwirtschaft und Ernährung; Struktur und Institution";"Berichterstattung im Wassersektor";"Journalismus im Wassersektor";"";"water journalism";"water reporting";"";"journalisme bleu";"";"";"giornalismo blu";"";""
"Diplomatie und Protokoll; HR; Migration";"Visasticker";"Visummarke";"";"visa sticker";"";"";"vignette-visa";"";"";"visto adesivo";"";""
"Frieden und Sicherheit; Menschenrechte; Struktur und Institution";"Reporter ohne Grenzen";"";"";"Reporters Without Borders";"";"";"Reporters sans frontières";"";"";"Reporter senza frontiere";"";""
"Bildung";"IMPACT-se";"Institut zur Überwachung von Frieden und kultureller Toleranz in der Schulbildung";"";"IMPACT-se";"Institute for Monitoring Peace and Cultural Tolerance in School Education";"";"IMPACT-se";"Institut de surveillance de la paix et de la tolérance culturelle dans l'éducation scolaire";"";"IMPACT-se";"Istituto per il monitoraggio della pace e della tolleranza culturale nell’istruzione scolastica";""
"Migration";"Remigration";"Rückwanderung";"";"return migration";"";"";"migration de retour";"";"";"migrazione di ritorno";"";""
"Entwicklung und Zusammenarbeit; Recht";"Katastrophenhilfeabkommen";"Rahmenabkommen der Katastrophenhilfe";"";"disaster relief agreement";"";"";"accord sur l'assistance en cas de catastrophe";"accord-cadre en cas de catastrophe";"";"accordo sull’aiuto in caso di catastrofe";"";""
"Entwicklung und Zusammenarbeit";"delegierte Zusammenarbeit";"";"";"delegated cooperation";"";"";"coopération déléguée";"";"";"cooperazione delegata";"";""
"Entwicklung und Zusammenarbeit; Recht";"Kofinanzierungsabkommen";"Vereinbarung über gemeinsame Finanzierung";"";"joint financing agreement";"";"";"accord de cofinancement";"convention de cofinancement";"";"accordo di cofinanziamento";"";""
"Entwicklung und Zusammenarbeit; Struktur und Institution";"Operationszirkel";"";"";"operations committee";"";"";"cercle opérationnel";"";"";"";"";""
"Energie und Umwelt; Entwicklung und Zusammenarbeit; Frieden und Sicherheit; Menschenrechte; Sicherheit; Wirtschaft und Finanzen";"International Cyanide Management Code";"Internationaler Kodex für Herstellung, Transport und Verwendung von Cyaniden in der Goldproduktion";"";"Cyanide Code";"";"International Cyanide Management Code";"";"Code international de gestion du cyanure";"";"Codice internazionale di gestione del cianuro";"";""
"Humanitäre Hilfe; Struktur und Institution";"Central Tracing Agency";"";"Zentraler Suchdienst";"Central Tracing Agency";"";"";"";"Agence centrale de recherches";"";"Agenzia centrale di ricerca";"Servizio di ricerca";""
"Humanitäre Hilfe";"Rotkreuz-Nachricht";"";"";"";"Red Cross Message";"";"";"message Croix-Rouge";"";"";"Messaggio di Croce Rossa";""
"Wissenschaft und Technologie";"Campus Biotech";"";"";"Campus Biotech";"";"";"Campus Biotech";"";"";"Campus Biotech";"";""
"Recht; Sicherheit; Verkehr";"Pariser MoU";"Pariser Vereinbarung über die Hafenstaatkontrolle";"";"Paris Memorandum of Understanding on Port State Control";"Paris MoU";"";"mémorandum d’entente de Paris sur le contrôle des navires par l’État du port";"protocole d'entente de Paris sur le contrôle des navires par l'État du port";"";"memorandum d'intesa di Parigi";"memorandum d'intesa di Parigi relativo al controllo delle navi da parte dello Stato di approdo";"MOU di Parigi"
"Energie und Umwelt; Politik";"Jugendklimagipfel";"";"";"Youth Climate Summit";"";"";"Sommet de la jeunesse pour le climat";"Sommet de la jeunesse sur l'action pour le climat";"";"Vertice dei giovani per il clima";"vertice dei giovani sul clima";"Youth Climate Summit"
"Bildung; Energie und Umwelt";"Schweizer Verband Studentischer Organisationen für Nachhaltigkeit";"";"";"Swiss Association of Student Organizations for Sustainability";"";"";"";"Fédération suisse d’organisations étudiantes pour un développement durable";"";"Federazione svizzera delle organizzazioni studentesche per lo sviluppo sostenibile";"";""
"Gesundheit";"besorgniserregende Variante";"";"";"variant of concern";"";"";"variant préoccupant";"";"";"variante preoccupante";"";""
"Recht";"Völkerrechtssubjekt";"";"";"international legal person";"international legal subject";"subject of international law";"personne juridique internationale";"sujet de droit international public";"";"persona giuridica internazionale";"soggetto di diritto internazionale pubblico";""
"Struktur und Institution";"EU-Koordination";"";"";"EU Coordination";"";"";"Coordination UE";"";"";"Coordinamento UE";"";""
"Kultur; Sport";"Stadion-Diplomatie";"";"";"stadium diplomacy";"";"";"diplomatie des stades";"";"";"diplomazia degli Stadi";"";""
"Bildung; Politik";"Aktionsplan für digitale Bildung";"";"";"Digital Education Action Plan";"";"";"plan d’action en matière d’éducation numérique";"";"";"Piano d'azione per l'istruzione digitale";"";""
"Informatik und Telekommunikation";"europäische Datenstrategie";"";"";"European Data Strategy";"";"";"stratégie européenne pour les données";"";"";"strategia europea in materia di dati";"";""
"Wirtschaft und Finanzen";"einheitlicher Euro-Zahlungsverkehrsraum";"";"";"";"Single Euro Payments Area";"";"espace unique de paiement en euros";"";"";"Area unica dei pagamenti in euro";"";""
"Buchhaltung; Wirtschaft und Finanzen";"";"International Financial Reporting Standards";"internationale Rechnungslegungsstandards";"";"International Financial Reporting Standards";"";"normes IFRS";"normes internationales d’information financière";"";"";"principi contabili internazionali";""
"Energie und Umwelt";"";"Freunde der Reform von Subventionen fossiler Energieträger";"Friends of Fossil Fuel Subsidy Reform";"";"Friends of Fossil Fuel Subsidy Reform";"";"Amis de la réforme des subventions aux énergies fossiles";"";"";"Amici della riforma dei sussidi ai combustibili fossili";"";"Friends of Fossil Fuel Subsidies Reform"
"Energie und Umwelt";"EnDev";"Energising Development";"";"EnDev";"Energising Development";"";"EnDev";"partenariat de développement énergétique";"";"EnDev";"partenariato Energising Development";""
"Energie und Umwelt";"Nachhaltige Energie für alle";"SE4All";"SE4ALL";"SE4All";"SEforALL";"Sustainable Energy for All";"Énergie durable pour tous";"SE4All";"";"«Energia sostenibile per tutti»";"SE4All";""
"Energie und Umwelt; Wirtschaft und Finanzen";"Abkommen über Klimawandel, Handel und Nachhaltigkeit";"";"";"";"Agreement on Climate Change, Trade and Sustainability";"";"Accord sur le changement climatique, le commerce et la durabilité";"";"";"Accordo sul cambiamento climatico, il commercio e la sostenibilità";"";""
"Entwicklung und Zusammenarbeit; Gesundheit";"Medicines for Malaria Venture";"";"Partnerschaft «Medikamente gegen Malaria»";"Medicines for Malaria Venture";"";"";"Partenariat Médicaments contre le paludisme";"";"";"Medicines for Malaria Venture";"";""
"Konsularische Angelegenheiten";"mobile Passstation";"MobiS";"";"mobile passport unit";"";"";"poste mobile pour les passeports";"";"";"stazione mobile per il rilascio di passaporti";"";""
"Frieden und Sicherheit";"Territorialstaat";"";"";"territorial state";"";"";"État territorial";"";"";"Stato territoriale";"";""
"Frieden und Sicherheit";"Herkunftsstaat";"";"";"home state";"";"";"État d'origine";"";"";"stato d'origine";"";""
"Gesundheit; Struktur und Institution; Wissenschaft und Technologie";"";"Foundation for Innovative New Diagnostics";"Stiftung für innovative neue Diagnostika";"";"Foundation for Innovative New Diagnostics";"";"";"Fondation pour de nouveaux diagnostics innovants";"Foundation for innovative new diagnostics";"";"Foundation for Innovative New Diagnostics";""
"Frieden und Sicherheit; Sicherheit";"unmittelbare Teilnahme an Feindseligkeiten";"";"";"direct participation in hostilities";"";"";"participation directe à des hostilités";"";"";"partecipazione diretta a ostilità";"";""
