"Header.Sachgebiete";"DES.Term(1)";"DES.Term(2)";"DES.Term(3)";"ENG.Term(1)";"ENG.Term(2)";"ENG.Term(3)";"FRS.Term(1)";"FRS.Term(2)";"FRS.Term(3)";"ITS.Term(1)";"ITS.Term(2)";"ITS.Term(3)"
"Frieden und Sicherheit";"Schutzdetachement";"";"";"protection detachment";"";"";"détachement de protection";"";"";"distaccamento di protezione";"";""
"Diplomatie und Protokoll; HR; Struktur und Institution";"";"Verein Diplomatinnen im EDA";"";"Association of Women Diplomats in the FDFA";"";"";"Association des femmes diplomates au DFAE";"";"";"Associazione delle donne diplomatiche del DFAE";"";""
"Andere";"Übersetzungsauftrag";"";"";"translation request";"";"";"mandat de traduction";"traduction";"";"mandato di traduzione";"";""
"Tourismus";"Plane gut. Reise gut.";"";"";"Plan well. Travel well.";"";"";"Départ réfléchi. Voyage réussi.";"";"";"Preparati bene. Viaggerai bene.";"";""
"Arbeit und Beschäftigung; Energie und Umwelt; Entwicklung und Zusammenarbeit; Frieden und Sicherheit; Gender; Gesundheit; Humanitäre Hilfe; Landwirtschaft und Ernährung; Migration; Recht";"Menschenrechte";"";"";"human rights";"";"";"droits de l'homme";"droits humains";"";"diritti dell'uomo";"diritti umani";""
"Entwicklung und Zusammenarbeit";"";"konfliktsensitives Programmmanagement";"";"conflict-sensitive programme management";"";"";"gestion des programmes sensible aux conflits";"";"";"";"gestione dei programmi sensibile ai conflitti";""
"Energie und Umwelt; Struktur und Institution";"";"Europäische Umweltagentur";"";"";"European Environment Agency";"";"";"Agence européenne pour l'environnement";"";"";"Agenzia europea dell'ambiente";""
"Entwicklung und Zusammenarbeit; Struktur und Institution";"";"Internationale Entwicklungsorganisation";"";"";"International Development Association";"";"";"Association internationale de développement";"";"";"Associazione internazionale per lo sviluppo";""
"Bildung; Struktur und Institution";"nationaler Bildungsstandard";"";"";"national educational standard";"";"";"standard national de formation";"";"";"standard di formazione nazionale";"";""
"Wirtschaft und Finanzen";"PSP-Element";"";"";"WBS element";"";"";"élément d'OTP";"";"";"elemento WBS";"";""
"Wirtschaft und Finanzen";"Innenauftrag";"";"";"internal order";"";"";"ordre interne";"";"";"ordine interno";"";""
"HR";"Mahlzeitenpauschale";"";"";"food allowance";"lump-sum food allowance";"lump-sum food reimbursement";"forfait pour repas";"";"";"forfait per i pasti";"";""
"Wirtschaft und Finanzen";"finanzierungswirksam";"fw";"";"of financial consequence";"recognised in net lending/borrowing";"recognised in the financing statement";"";"avec incidences financières";"";"con incidenza sul finanziamento";"if";""
"Struktur und Institution";"Team Thematische Aspekte";"";"";"Thematic Aspects Team";"";"";"";"";"";"team Aspetti tematici";"";""
"Arbeit und Beschäftigung; Bildung; HR";"Hochschulpraktikum";"";"";"academic internship";"internship";"";"stage académique";"";"";"praticantato universitario";"";""
"Recht";"";"Zuschlagskriterium";"";"award criterion";"";"";"";"critère d'adjudication";"";"criterio d'aggiudicazione";"";""
"Wirtschaft und Finanzen";"nf";"";"nicht finanzierungswirksam";"not recognised in net lending/borrowing";"not recognised in the financing statement";"with no financing effect";"sans incidences financières";"";"";"che non incidono sul finanziamento";"senza incidenza sul finanziamento";"sif"
"Struktur und Institution; Arbeit und Beschäftigung; Diplomatie und Protokoll; HR";"Sekretariats- und Fachdienst";"";"";"";"";"";"service de secrétariat et spécialisé";"";"";"servizio di segreteria e specializzato";"";""
"Konsularische Angelegenheiten";"Konsularbezirk";"Konsularkreis";"";"consular district";"";"";"arrondissement consulaire";"circonscription consulaire";"";"circondario consolare";"circoscrizione consolare";""
"Wirtschaft und Finanzen";"Geschäftsbeziehung";"";"";"business relationship";"";"";"relation d'affaires";"";"";"relazione d'affari";"";""
"Beschaffungswesen";"freihändige Vergabe";"";"";"direct award";"direct awarding";"";"adjudication de gré à gré";"";"";"aggiudicazione mediante trattativa privata";"";""
"Entwicklung und Zusammenarbeit; Struktur und Institution";"Staffel";"";"";"unit";"";"";"esquadrille";"unité";"";"squadra";"";""
"HR; Konsularische Angelegenheiten; Struktur und Institution";"Betriebsmanagement";"";"";"";"operational management";"";"gestion opérationnelle";"";"";"gestione operativa";"";""
"Diplomatie und Protokoll";"diplomatische Aufgaben";"";"";"diplomatic tasks";"";"";"fonctions diplomatiques";"";"";"funzioni diplomatiche";"";""
"Bildung";"Regelstruktur";"";"";"";"";"";"structure ordinaire";"";"";"struttura ordinaria";"";""
"Struktur und Institution";"Kommissariat Menschenhandel/Menschenschmuggel";"Kommissariat MM";"";"Human Trafficking and Migrant Smuggling Section";"";"";"Commissariat Traite d'êtres humains et traite de migrants";"Commissariat TT";"";"Commissariato Tratta di esseri umani e traffico di migranti";"";""
"Gender; Struktur und Institution";"Chancengleichheit EDA";"";"";"FDFA Equal Opportunities";"";"";"Egalité des chances DFAE";"";"";"Pari opportunità DFAE";"";""
"Entwicklung und Zusammenarbeit";"Backstopping";"";"";"backstopping";"";"";"backstopping";"";"";"backstopping";"";""
"Entwicklung und Zusammenarbeit";"";"öffentliche Entwicklungshilfe";"";"";"official development assistance";"";"aide publique au développement";"";"";"aiuto pubblico allo sviluppo";"";""
"Wirtschaft und Finanzen";"Revisor";"";"";"";"";"";"auditeur";"";"";"revisore";"";""
"Entwicklung und Zusammenarbeit";"Eigenverantwortung";"";"";"ownership";"";"";"appropriation";"";"";"appropriazione";"";""
"Frieden und Sicherheit";"";"Kriseneinsatzpool";"";"Crisis Intervention Pool";"";"";"";"pool d'intervention en cas de crise";"";"";"Pool d’intervento in caso di crisi";""
"Struktur und Institution";"Schweizerisches Korps für humanitäre Hilfe";"";"";"";"Swiss Humanitarian Aid Unit";"";"Corps suisse d'aide humanitaire";"";"";"Corpo svizzero di aiuto umanitario";"";""
"Entwicklung und Zusammenarbeit; Struktur und Institution; Wirtschaft und Finanzen";"";"AsDB";"Asiatische Entwicklungsbank";"";"Asian Development Bank";"";"Banque asiatique de développement";"BAsD";"";"";"AsDB";"Banca asiatica di sviluppo"
"Beschaffungswesen";"Eignungskriterium";"";"";"eligibility criterion";"";"";"critère d'aptitude";"critère de qualification";"";"criterio di idoneità";"";""
"Bildung";"Pädagogische Hochschule";"";"";"university of teacher education";"";"";"haute école pédagogique";"";"";"alta scuola pedagogica";"";""
"Wirtschaft und Finanzen";"Hochrangige Gruppe für globale Nachhaltigkeit";"";"";"Panel on Global Sustainability";"";"";"Groupe de haut niveau sur la viabilité de l'environnement mondial";"";"";"panel sulla sostenibilità globale";"";""
"Gender";"Genderanalyse";"";"";"gender analysis";"";"";"analyse de genre";"analyse selon le genre";"";"analisi di genere";"";""
"Entwicklung und Zusammenarbeit; Struktur und Institution";"Nordafrika";"";"";"North Africa";"";"";"Afrique du Nord";"";"";"Africa del Nord";"Nord Africa";""
"Struktur und Institution";"";"Abteilung Asien und Pazifik";"";"";"Asia and Pacific";"Asia and Pacific Division";"Asie et Pacifique";"";"division Asie et Pacifique";"Asia e Pacifico";"";"Divisione Asia e Pacifico"
"HR; Diplomatie und Protokoll";"Rotationspersonal";"";"";"rotating staff";"rotational personnel";"rotational staff";"personnel de rotation";"";"";"personale soggetto a rotazione";"";""
"Geschäftsverwaltung; Informatik und Telekommunikation; Struktur und Institution";"«C»-Akte";"kassierbares Dossier";"";"'C' file";"record eligible for destruction";"";"document C";"dossier « C »";"dossier non soumis à versement";"atto «C»";"";""
"Geschäftsverwaltung; Struktur und Institution";"«A»-Akte";"";"";"'A' file";"";"";"dossier « A »";"";"";"atto «A»";"";""
"Geschäftsverwaltung; Struktur und Institution";"«B»-Akte";"";"";"'B' file";"";"";"dossier « B »";"";"";"atto «B»";"";""
"Frieden und Sicherheit";"Ermittlungskommission";"";"";"fact-finding commission";"";"";"commission d'établissement des faits";"";"";"commissione per l'accertamento dei fatti";"";""
"HR";"Abgangsentschädigung";"";"";"severance pay";"severence allowance";"";"";"indemnité de départ";"";"indennità di partenza";"";""
"HR; Recht";"";"Alters-, Hinterlassenen- und Invalidenvorsorge";"";"old-age, survivors' and invalidity capital";"";"";"prévoyance vieillesse, survivants et invalidité";"";"";"previdenza per la vecchiaia, i superstiti e l’invalidità";"";""
"Arbeit und Beschäftigung; HR; Versicherungswesen; Wirtschaft und Finanzen";"Kranken-, Unfall- und Mutterschaftsversicherung";"";"";"";"health, accident and maternity insurance";"";"assurance-maladie, accidents et maternité";"";"";"assicurazione contro le malattie, gli infortuni e la maternità";"";""
"Arbeit und Beschäftigung";"lernende Organisation";"";"";"learning organisation";"";"";"organisation apprenante";"";"";"organizzazione che apprende";"";""
"Wirtschaft und Finanzen";"Buchungskreis";"";"";"company code";"";"";"périmètre comptable";"";"";"gruppo contabile";"settore contabile";""
"Reduktion von Katastrophenrisiken";"Katastrophenvorsorge";"Verminderung des Katastrophenrisikos";"Verringerung des Katastrophenrisikos";"disaster risk prevention";"disaster risk reduction";"";"réduction des risques de catastrophe";"";"";"";"riduzione del rischio di catastrofi";"riduzione del rischio di disastri"
"HR";"diplomatische Mitarbeiterin";"diplomatischer Mitarbeiter";"";"diplomat desk officer";"";"";"collaborateur diplomatique";"collaboratrice diplomatique";"";"collaboratore diplomatico";"";""
"Arbeit und Beschäftigung; Diplomatie und Protokoll; HR";"Begleitperson";"";"";"accompanying person";"";"";"personne accompagnante";"";"";"persona di accompagnamento";"";""
"Diplomatie und Protokoll";"Sonderbeauftragter für den Südkaukasus";"";"";"special representative for the South Caucasus";"";"";"représentant spécial pour le Caucase du Sud";"";"";"rappresentante speciale per il Caucaso meridionale";"";""
"Humanitäre Hilfe; Struktur und Institution";"Delegierter des Bundesrats für humanitäre Hilfe und SKH";"Delegierter für humanitäre Hilfe und Chef SKH";"";"Federal Council delegate for Swiss Humanitarian Aid and head of the SHA";"Federal Council delegate for Swiss Humanitarian Aid";"head of Swiss Humanitarian Aid";"délégué à l'aide humanitaire et chef du CSA";"délégué du Conseil fédéral à l’aide humanitaire et chef du CSA";"";"delegato del Consiglio federale per l'aiuto umanitario e capo del Corpo svizzero d'aiuto umanitario";"delegato per l'aiuto umanitario e capo del CSA";"delegato per l'aiuto umanitario e capo del Corpo svizzero d'aiuto umanitario"
"Bildung";"Weltbildungsbericht";"";"";"GEM Report";"Global Education Monitoring Report";"";"Rapport mondial de suivi sur l'éducation";"";"";"Rapporto mondiale sull'educazione";"";""
"Geschäftsverwaltung; Struktur und Institution";"«E»-Akte";"";"";"'E' file";"";"";"dossier « E »";"";"";"atto «E»";"";""
"Andere";"Hausdienstmaterial";"";"";"housekeeping material";"";"";"matériel pour le service domestique";"";"";"materiale per il servizio domestico";"";""
"Geschäftsverwaltung";"Registraturplan";"";"";"file plan";"registry plan";"RegPlan";"plan de classement";"";"";"";"";""
"Wirtschaft und Finanzen";"Buchungstext";"";"";"posting text";"";"";"texte des écritures comptables";"";"";"testo contabile";"";""
"Entwicklung und Zusammenarbeit; Humanitäre Hilfe; Landwirtschaft und Ernährung";"Existenzsicherung";"Lebensgrundlagen";"";"livelihood";"";"";"moyen d'existence";"moyens d'existence";"moyens de subsistance";"basi vitali";"mezzi di sostentamento";"mezzi di sussitenza"
"Struktur und Institution";"F+S net";"Netzwerk Finanzmanagement und Systeme";"";"F+S net";"Finance Management and Systems";"";"réseau F+S";"réseau Gestion financière et systèmes";"";"F+S net";"rete interna Management finanziario e sistemi";""
"Entwicklung und Zusammenarbeit; Politik";"globale Gouvernanz";"";"";"global governance";"";"";"gouvernance mondiale";"";"";"governance globale";"";""
"Energie und Umwelt";"Einzugsgebiet";"";"";"catchment";"catchment area";"watershed";"bassin d'alimentation";"bassin d'alimentation de captage";"bassin versant";"bacino idrografico";"bacino imbrifero";""
"Entwicklung und Zusammenarbeit; Politik";"globales öffentliches Gut";"";"";"global public good";"";"";"bien public mondial";"";"";"bene pubblico globale";"";""
"Energie und Umwelt";"Bunkerkraftstoff";"";"";"bunker fuel oil";"";"";"fioul de soute";"";"";"olio combustibile di bunkeraggio";"";""
"Wirtschaft und Finanzen";"Stammkostenstelle";"";"";"master cost centre";"";"";"centre de coûts de base";"";"";"centro di costo primario";"";""
"Wirtschaft und Finanzen";"Projektstrukturplan";"";"";"";"work breakdown structure";"";"organigramme technique de projet";"";"";"piano strutturale del progetto";"";""
"Entwicklung und Zusammenarbeit";"personelle Entwicklungszusammenarbeit";"";"";"personnel exchange in development cooperation";"";"";"échange de personnes dans la coopération au développement";"";"";"cooperazione allo sviluppo attraverso lo scambio di personale volontario";"cooperazione allo sviluppo individuale";""
"Recht";"Recht auf ein faires Verfahren";"";"";"right to a fair trial";"";"";"droit à un procès équitable";"";"";"diritto a un processo equo";"";""
"Frieden und Sicherheit; Recht";"Schweizerisches Kompetenzzentrum für Menschenrechte";"";"";"";"Swiss Centre of Expertise in Human Rights";"";"Centre suisse de compétence pour les droits humains";"";"";"Centro svizzero di competenza per i diritti umani";"";""
"Recht";"humanitäres Völkerrecht";"";"ius in bello";"";"international humanitarian law";"law of armed conflict";"";"droit de la guerre";"droit des conflits armés";"diritto internazionale umanitario";"";"ius in bello"
"Recht";"Recht auf Leben";"";"";"right to life";"";"";"droit à la vie";"";"";"diritto alla vita";"";""
"Menschenrechte";"Leibeigenschaft";"";"";"serfdom";"servitude";"";"servitude";"";"";"servitù";"";""
"Recht; Wirtschaft und Finanzen";"IDAG Korruptionsbekämpfung";"Interdepartementale Arbeitsgruppe zur Korruptionsbekämpfung";"";"Interdepartmental Working Group on Combating Corruption";"";"";"Groupe de travail interdépartemental pour la lutte contre la corruption";"GTID Lutte contre la corruption";"";"GLID Lotta alla corruzione";"Gruppo di lavoro interdipartimentale per la lotta contro la corruzione";""
"Struktur und Institution";"Dokumentationsdienst";"";"";"Documentation Service";"";"";"Service de documentation";"";"";"Servizio di documentazione";"";""
"HR";"Auslandleistungen";"";"";"foreign assignment allowances";"";"";"prestations à l'étranger";"";"";"Prestazioni all'estero";"";""
"Recht";"bilateraler Ansatz";"bilateraler Weg";"";"bilateral approach";"bilateral path";"bilateral way";"approche bilatérale";"voie bilatérale";"";"approccio bilaterale";"via bilaterale";""
"Konsularische Angelegenheiten; Diplomatie und Protokoll; Struktur und Institution";"Auslandvertretung des Typs IW-P (Basis)";"diplomatische Interessenwahrungspräsenz (Basis)";"IW-P (Basis)";"basic diplomatic presence for safeguarding Switzerland's interests";"diplomatic presence for safeguarding Switzerland's interests (basic)";"DP-I Basic";"P-DI (de base)";"présence diplomatique à vocation de défense des intérêts (de base)";"";"P-TI (base)";"presenza diplomatica di tutela degli interessi (base)";"rappresentanza all’estero di tipo P-TI (base)"
"Recht";"Bilaterale I";"";"";"Bilaterals I";"Bilaterals I package of agreements";"";"Accords bilatéraux I";"";"";"Accordi bilaterali I";"Bilaterali I";""
"Recht";"Bilaterale II";"";"";"Bilaterals II";"Bilaterals II package of agreements";"";"Accords bilatéraux II";"";"";"Accordi bilaterali II";"Bilaterali II";""
"Struktur und Institution";"Direktion für Völkerrecht";"";"";"";"Directorate of International Law";"";"";"Direction du droit international public";"";"";"Direzione del diritto internazionale pubblico";""
"Politik; Struktur und Institution";"Internationale Organisation der Frankophonie";"";"";"International Organisation of La Francophonie";"";"";"";"Organisation internationale de la francophonie";"";"";"Organizzazione internazionale della Francofonia";""
"Frieden und Sicherheit";"";"";"private Militär- und Sicherheitsunternehmen";"PMSCs";"private military and security companies";"";"";"entreprises militaires et de sécurité privées";"";"";"società militari e società di sicurezza private";""
"Struktur und Institution";"Abteilung Personal EDA";"Personal EDA";"";"FDFA Human Resources";"";"";"division Personnel DFAE";"Personnel DFAE";"";"Divisione Personale DFAE";"Personale DFAE";""
"Diplomatie und Protokoll";"Botschaft";"KL-B";"klassische Botschaft";"CL-E";"embassy";"standard embassy";"A-CL";"ambassade";"ambassade classique";"A-CL";"ambasciata";"ambasciata classica"
"Diplomatie und Protokoll";"Generalkonsulat";"";"";"consulate general";"";"";"consulat général";"";"";"consolato generale";"";""
"Diplomatie und Protokoll; HR; Konsularische Angelegenheiten";"R-KC";"Regionales Konsularcenter";"";"R-CC";"regional consular centre";"";"CC-R";"centre consulaire régional";"";"CC-R";"Centro consolare regionale";""
"Diplomatie und Protokoll";"diplomatische Interessenwahrungspräsenz (Standard)";"IW-P (Standard)";"";"diplomatic presence for safeguarding Switzerland's interests (standard)";"DP-I Standard";"";"P-DI (standard)";"présence diplomatique à vocation de défense des intérêts (standard)";"";"P-TI (standard)";"presenza diplomatica di tutela degli interessi (standard)";""
"Frieden und Sicherheit; Politik";"Besetztes Palästinensisches Gebiet";"";"";"occupied Palestinian territory";"oPt";"";"Territoire palestinien occupé";"territoire palestinien occupé";"";"Territorio palestinese occupato";"";""
"Andere";"";"Sonderschutzfahrzeug";"";"armoured car";"armoured vehicle";"";"véhicule blindé";"";"";"";"veicolo speciale di protezione";""
"Frieden und Sicherheit";"Mission der Vereinten Nationen zur Übergangsverwaltung des Kosovo";"Übergangsverwaltungsmission der Vereinten Nationen im Kosovo";"";"United Nations Interim Administration Mission in Kosovo";"";"";"";"Mission d’administration intérimaire des Nations Unies au Kosovo";"";"Missione delle Nazioni Unite per l'amministrazione provvisoria in Kosovo";"Missione delle Nazioni Unite per un'amministrazione provvisoria in Kosovo";""
"Landwirtschaft und Ernährung";"Ernährungsunsicherheit";"Nahrungsunsicherheit";"";"food insecurity";"";"";"insécurité alimentaire";"";"";"insicurezza alimentare";"mancanza di sicurezza alimentare";""
"Frieden und Sicherheit";"Blindgänger";"";"";"unexploded ordnance";"";"";"munition non explosée";"";"";"ordigno inesploso";"proiettile inesploso";""
"Frieden und Sicherheit";"";"explosive Kriegsmunitionsrückstände";"";"";"explosive remnants of war";"";"débris de guerre explosifs";"restes explosifs de guerre";"";"residuati bellici esplosivi";"";""
"Politik";"Rechenschaftspflicht";"";"";"accountability";"";"";"obligation de rendre des comptes";"redevabilité";"responsabilité devant les citoyens";"accountability";"obbligo di rendere conto del proprio operato";"obbligo di rendiconto"
"Entwicklung und Zusammenarbeit";"Feldbüro";"";"";"field office";"";"";"bureau de terrain";"";"";"ufficio distaccato";"";""
"Struktur und Institution";"Abteilung Wohlstand und Nachhaltigkeit";"";"";"Prosperity and Sustainability Division";"";"";"division Prospérité et durabilité";"";"";"Divisione Prosperità e sostenibilità";"";""
"Struktur und Institution";"Präsidiale Angelegenheiten und Protokoll";"";"";"Presidential Affairs and Protocol";"";"";"Affaires présidentielles et protocole";"";"";"Affari presidenziali e protocollo";"";""
"Humanitäre Hilfe";"Wiederherstellung der Lebensgrundlagen";"";"";"livelihood rehabilitation";"rehabilitation of livelihoods";"restoring livelihoods";"rétablissement des moyens de subsistance";"";"";"ripristino delle basi vitali";"";""
"Landwirtschaft und Ernährung";"Nachernteverlust";"";"";"post-harvest loss";"";"";"perte après récolte";"";"";"perdita post raccolto";"";""
"Entwicklung und Zusammenarbeit; Wirtschaft und Finanzen";"";"Staatssekretariat für Wirtschaft";"";"";"State Secretariat for Economic Affairs";"";"";"Secrétariat d’État à l’économie";"";"";"Segreteria di Stato dell’economia";""
"Recht";"Völkergewohnheitsrecht";"";"";"customary international law";"";"";"droit international coutumier";"";"";"diritto consuetudinario internazionale";"";""
"Diplomatie und Protokoll";"ausserordentlicher und bevollmächtigter Botschafter";"";"";"ambassador extraordinary and plenipotentiary";"";"";"ambassadeur extraordinaire et plénipotentiaire";"";"";"ambasciatore straordinario e plenipotenziario";"";""
"Migration";"";"Europäisches Unterstützungsbüro für Asylfragen";"";"";"European Asylum Support Office";"";"Bureau européen d’appui en matière d'asile";"";"";"";"Ufficio europeo di sostegno per l'asilo";""
"Frieden und Sicherheit; Struktur und Institution";"";"Genfer Zentrum für Sicherheitspolitik";"";"";"Geneva Centre for Security Policy";"";"Centre de politique de sécurité, Genève";"";"";"Centro ginevrino per la politica di sicurezza";"";""
"Frieden und Sicherheit; Struktur und Institution";"Genfer Internationales Zentrum für humanitäre Minenräumung";"";"";"Geneva International Centre for Humanitarian Demining";"";"";"Centre international de déminage humanitaire de Genève";"";"";"Centro internazionale di sminamento umanitario";"Centro internazionale per lo sminamento umanitario";""
"Frieden und Sicherheit; Struktur und Institution";"";"Genfer Zentrum für die Gouvernanz des Sicherheitssektors";"";"";"Geneva Centre for Security Sector Governance";"";"Centre pour la gouvernance du secteur de la sécurité";"";"";"Centro per la governance del settore della sicurezza";"";""
"Entwicklung und Zusammenarbeit; Struktur und Institution";"Hilfswerk der Vereinten Nationen für Palästinaflüchtlinge im Nahen Osten";"";"";"United Nations Relief and Works Agency for Palestine Refugees in the Near East";"";"";"Office de secours et de travaux des Nations Unies pour les réfugiés de Palestine dans le Proche-Orient";"";"";"Agenzia delle Nazioni Unite per il soccorso e l’occupazione dei profughi palestinesi in Medio Oriente";"Agenzia ONU per i rifugiati palestinesi";""
"Diplomatie und Protokoll; Entwicklung und Zusammenarbeit; Frieden und Sicherheit; Politik; Struktur und Institution";"Östliche Partnerschaft";"";"";"Eastern Partnership";"";"";"Partenariat oriental";"";"";"Partenariato orientale";"";""
"Entwicklung und Zusammenarbeit";"Entwicklungsprogramm der Vereinten Nationen";"";"";"";"United Nations Development Programme";"";"";"Programme des Nations Unies pour le développement";"";"";"Programma di sviluppo delle Nazioni Unite";""
"Entwicklung und Zusammenarbeit; Struktur und Institution";"";"Direktion für Entwicklung und Zusammenarbeit";"";"";"Swiss Agency for Development and Cooperation";"";"";"Direction du développement et de la coopération";"";"Direzione dello sviluppo e della cooperazione";"";""
"Frieden und Sicherheit";"Binnenvertriebener";"intern Vertriebener";"";"";"internally displaced person";"";"déplacé interne";"";"personne déplacée";"profugo interno";"sfollato";"sfollato interno"
"Frieden und Sicherheit; Entwicklung und Zusammenarbeit";"Transitionszusammenarbeit";"";"";"transition cooperation";"";"";"aide à la transition";"";"";"cooperazione di transizione";"";""
"Informatik und Telekommunikation; Wissenschaft und Technologie";"Geoinformationssystem";"";"";"geographical information system";"";"";"";"système d’information géographique";"";"";"sistema di informazione geografica";""
"Informatik und Telekommunikation; Wissenschaft und Technologie";"Geodaten";"";"";"geodata";"";"";"géodonnées";"";"";"geodati";"";""
"Informatik und Telekommunikation; Wissenschaft und Technologie";"Geoinformation";"";"";"geoinformation";"";"";"géoinformation";"";"";"geoinformazione";"";""
"Informatik und Telekommunikation; Wissenschaft und Technologie";"Geodienste";"";"";"geodata services";"";"";"géoservices";"";"";"geoservizi";"";""
"Entwicklung und Zusammenarbeit";"ergebnisorientiertes Management";"";"";"";"results-based management";"";"gestion axée sur les résultats";"";"";"gestione basata sui risultati";"gestione incentrata sui risultati";"gestione orientata ai risultati"
"Recht; Wirtschaft und Finanzen";"Belegenheitsland";"Belegenheitsstaat";"";"";"";"";"Etat de situation";"";"";"Stato contraente in cui gli immobili sono situati";"Stato in cui il bene è situato";""
"Politik; Struktur und Institution";"Bundespräsident";"";"";"President of the Confederation";"President of the Swiss Confederation";"";"président de la Confédération";"";"";"presidente della Confederazione";"";""
"Frieden und Sicherheit; Struktur und Institution";"Kommission für Friedenskonsolidierung";"";"";"";"Peacebuilding Commission";"";"";"Commission de consolidation de la paix";"";"Commissione per il consolidamento della pace";"";""
"Konsularische Angelegenheiten; Wirtschaft und Finanzen";"Kassenschrank";"";"";"safe";"";"";"coffre-fort";"";"";"cassaforte";"";""
"Wirtschaft und Finanzen";"Neues Führungsmodell für die Bundesverwaltung";"";"";"New Management Model for the Federal Administration";"";"";"";"nouveau modèle de gestion de l’administration fédérale";"";"";"nuovo modello di gestione dell’Amministrazione federale";""
"Frieden und Sicherheit";"Klein- und Leichtwaffen";"Kleinwaffen und leichte Waffen";"";"small arms and light weapons";"";"";"armes légères et de petit calibre";"";"";"armi leggere e di piccolo calibro";"";""
