"Header.Sachgebiete";"DES.Term(1)";"DES.Term(2)";"DES.Term(3)";"ENG.Term(1)";"ENG.Term(2)";"ENG.Term(3)";"FRS.Term(1)";"FRS.Term(2)";"FRS.Term(3)";"ITS.Term(1)";"ITS.Term(2)";"ITS.Term(3)"
"Gesundheit; Menschenrechte";"Grundsätze ärztlicher Ethik im Zusammenhang mit der Rolle von medizinischem Personal, insbesondere von Ärzten, beim Schutz von Strafgefangenen und Inhaftierten vor Folter und anderer grausamer, unmenschlicher oder erniedrigender Behandlung oder Strafe";"";"";"Principles of Medical Ethics relevant to the Role of Health Personnel, particularly Physicians, in the Protection of Prisoners and Detainees against Torture and Other Cruel, Inhuman or Degrading Treatment or Punishment";"";"";"Principes d’éthique médicale applicables au rôle du personnel de santé, en particulier des médecins, dans la protection des prisonniers et des détenus contre la torture et autres peines ou traitements cruels, inhumains ou dégradants";"";"";"Principi di etica medica applicabili al ruolo del personale sanitario, in particolare dei medici, nella protezione dei prigionieri e dei reclusi contro la tortura e altre pene o trattamenti crudeli, inumani o degradanti";"";""
"Frieden und Sicherheit; Menschenrechte; Recht";"Richtlinien für die Untersuchung angeblicher Massaker durch die Vereinten Nationen";"";"";"Guidelines for the Conduct of United Nations Inquiries into Allegations of Massacres";"";"";"Principes régissant les enquêtes de l’ONU sur les allégations relatives à des massacres";"";"";"";"";""
"Recht; Struktur und Institution";"Internationaler, unparteiischer und unabhängiger Mechanismus zur Unterstützung der Ermittlungen gegen die Verantwortlichen für die seit März 2011 in der Arabischen Republik Syrien begangenen schwersten völkerrechtlichen Verbrechen und ihrer strafrechtlichen Verfolgung";"";"";"International, Impartial and Independent Mechanism to Assist in the Investigation and Prosecution of Persons Responsible for the Most Serious Crimes under International Law Committed in the Syrian Arab Republic since March 2011";"";"";"Mécanisme international, impartial et indépendant chargé de faciliter les enquêtes sur les violations les plus graves du droit international commises en République arabe syrienne depuis mars 2011 et d’aider à juger les personnes qui en sont responsables";"";"";"Meccanismo internazionale, imparziale e indipendente per assistere nelle indagini e nel perseguimento dei responsabili dei reati più gravi di diritto internazionale commessi nella Repubblica Araba Siriana dal marzo 2011";"";""
"Sicherheit; Struktur und Institution";"SiA";"Sicherheitsausschuss";"Sicherheitsausschuss des Bundesrats";"Security Committee";"";"";"Délégation pour la sécurité";"Délséc";"";"Delegazione Sicurezza";"DelSic";""
"Bildung";"Lernplattform des Bundes";"";"";"";"LMS learning platform";"";"";"plateforme d’apprentissage de la Confédération";"";"";"piattaforma didattica della Confederazione";""
"Entwicklung und Zusammenarbeit; Recht; Wirtschaft und Finanzen";"Blockierung";"Sperrung";"";"freezing";"seizure";"";"blocage";"gel";"saisie";"blocco";"";""
"Diplomatie und Protokoll; Politik; Struktur und Institution; Wirtschaft und Finanzen";"Gemeinsame Initiative für Erdöldaten";"";"Joint Organisations Data Initiative";"";"Joint Organisations Data Initiative";"";"";"Joint Organisations Data Initiative";"";"";"Joint Organisations Data Initiative";""
"Diplomatie und Protokoll; Politik; Recht";"Globalresolution";"Omnibus-Resolution";"";"omnibus resolution";"";"";"résolution omnibus";"";"";"risoluzione omnibus";"";""
"Energie und Umwelt; Entwicklung und Zusammenarbeit";"nachhaltige Bewirtschaftung der natürlichen Ressourcen";"nachhaltiges Ressourcenmanagement";"";"";"sustainable natural resource management";"sustainable resource management";"";"gestion durable des ressources";"gestion durable des ressources naturelles";"gestione sostenibile delle risorse";"";""
"Beschaffungswesen; Wirtschaft und Finanzen";"Genehmiger";"";"";"approver";"";"";"approbateur";"";"";"approvatore";"";""
"Struktur und Institution";"";"Welt-Anti-Doping-Agentur";"Welt-Antidopingagentur";"";"World Anti-Doping Agency";"";"Agence mondiale antidopage";"";"";"Agenzia mondiale antidoping";"";""
"Politik; Struktur und Institution";"";"Parlamentarische Versammlung der Frankophonie";"";"";"French-speaking Parliamentary Assembly";"";"";"Assemblée parlementaire de la Francophonie";"";"";"Assemblea parlamentare della Francofonia";""
"Struktur und Institution";"";"Konferenzzentrum Varembé";"";"";"Varembé Conference Centre";"";"";"Centre de conférence de Varembé";"";"";"Centro di conferenze di Verembé";""
"Struktur und Institution";"";"Internationale Elektrotechnische Kommission";"";"";"International Electrotechnical Commission";"";"";"Commission électrotechnique internationale";"";"Commissione elettrotecnica internazionale";"";""
"Struktur und Institution";"Pacific Islands Forum";"";"";"Pacific Islands Forum";"";"";"";"Forum des îles du Pacifique";"";"Forum delle Isole del Pacifico";"";""
"Politik; Struktur und Institution";"foraus";"Forum Aussenpolitik";"";"foraus";"Swiss Forum on Foreign Policy";"";"foraus";"Forum de politique étrangère";"";"foraus";"Forum di politica estera";""
"Informatik und Telekommunikation";"Ökosystem Web";"";"";"internet ecosystem";"";"";"écosystème du web";"";"";"ecosistema web";"";""
"Energie und Umwelt; Informatik und Telekommunikation";"Netzneutralität";"";"";"net neutrality";"";"";"neutralité du net";"neutralité du réseau";"";"neutralità della rete";"";""
"Entwicklung und Zusammenarbeit; Wissenschaft und Technologie";"Wissensgesellschaft";"";"";"knowledge society";"";"";"société du savoir";"";"";"società del sapere";"";""
"Menschenrechte; Migration";"ausbeuterische Migration";"";"";"exploitative migration";"";"";"migration à des fins d’exploitation";"";"";"migrazione per motivi di sfruttamento";"";""
"Migration";"erleichterte Migration";"";"";"facilitated migration";"";"";"migration facilitée";"";"";"migrazione facilitata";"";""
"Migration";"Brain Circulation";"";"";"brain circulation";"";"";"circulation des cerveaux";"";"";"circolazione di cervelli";"";""
"Migration";"kulturelle Vielfalt";"";"";"cultural diversity";"";"";"diversité culturelle";"";"";"diversità culturale";"";""
"Migration";"kultureller Pluralismus";"";"";"cultural pluralism";"";"";"pluralisme culturel";"";"";"pluralismo culturale";"";""
"Migration";"Umweltvertriebener";"";"";"environmentally displaced person";"environmentally-driven migrant";"";"personne déplacée pour des raisons environnementales";"";"";"sfollato per motivi ambientali";"";""
"Migration";"EU-Aussengrenze";"";"";"external EU border";"";"";"frontière extérieure de l’UE";"";"";"frontiera esterna UE";"";""
"Migration";"Familiennachzug";"Familienzusammenführung";"";"family reunification";"family reunion";"";"regroupement familial";"réunification familiale";"";"ricongiungimento familiare";"";""
"Migration";"Grenzgänger";"";"";"cross-border commuter";"frontier worker";"";"travailleur frontalier";"";"";"frontaliere";"";""
"Migration";"geschlechtsspezifische Verfolgung";"Verfolgung aufgrund des Geschlechts";"";"gender-based persecution";"";"";"persécution fondée sur le genre";"";"";"persecuzione di genere";"";""
"Migration";"Gruppenverfolgung";"Kollektivverfolgung";"";"group persecution";"";"";"persécution à l’encontre d’un groupe";"";"";"persecuzione di gruppo";"";""
"Migration";"Arbeitsmarkttest";"";"";"labour market test";"";"";"examen du marché de l’emploi";"examen du marché du travail";"";"analisi del mercato del lavoro";"";""
"Migration";"Mandatsflüchtling";"";"";"mandate refugee";"";"";"réfugié relevant du mandat du HCR";"";"";"rifugiato ex Mandato";"";""
"Struktur und Institution";"Junior Professional Officer";"";"";"";"junior professional officer";"";"";"jeune expert associé";"";"Junior Professional Officer";"";""
"Kultur; Struktur und Institution";"";"Internationaler Museumsrat";"";"";"International Council of Museums";"";"Conseil international des musées";"";"";"Consiglio internazionale dei musei";"";""
"Kultur";"Bergungsort";"";"";"safe haven";"";"";"refuge";"";"";"deposito protetto";"";""
"Arbeit und Beschäftigung; HR";"Entsendegespräch";"";"";"pre-deployment briefing";"";"";"réunion d'affectation";"";"";"colloquio di trasferimento";"";""
"HR";"interkulturelles Mentoring";"";"";"intercultural mentoring";"";"";"mentorat interculturel";"";"";"mentoring interculturale";"";""
"HR";"Ausrüstungs- und Einrichtungsvergütung";"";"";"allowance to cover expenses for supplies and settling-in";"reimbursement for supplies and settling-in";"";"indemnités d’installation et d’équipement";"";"";"rimborso delle spese per attrezzature ed equipaggiamenti";"";""
"Beschaffungswesen";"zentrale Beschaffungsstelle";"";"";"central procurement unit";"central purchasing body";"";"service d'achat central";"";"";"servizio centrale d'acquisto";"";""
"Recht";"Jachtenverordnung";"Verordnung über die schweizerischen Jachten zur See";"";"Ordinance on Swiss Ocean-Going Yachts";"Yachts Ordinance";"";"ordonnance sur les yachts";"ordonnance sur les yachts suisses naviguant en mer";"";"ordinanza sugli yacht";"ordinanza sugli yacht marittimi svizzeri";""
"Wirtschaft und Finanzen";"ausserbörslich gehandeltes Derivat";"OTC-Derivat";"";"OTC derivative";"over-the-counter derivative";"";"dérivé négocié de gré à gré";"dérivé OTC";"";"prodotto derivato over-the-counter (OTC)";"";""
"Energie und Umwelt; Struktur und Institution";"";"Weltwirtschaftsrat für nachhaltige Entwicklung";"";"";"World Business Council for Sustainable Development";"";"Conseil mondial des entreprises pour le développement durable";"";"";"Consiglio mondiale delle imprese per lo sviluppo sostenibile";"";"World Business Council for Sustainable Development"
"Diplomatie und Protokoll";"sanfte Diplomatie";"";"";"soft diplomacy";"";"";"diplomatie d'influence";"";"";"diplomazia morbida";"";""
"Diplomatie und Protokoll; Entwicklung und Zusammenarbeit; Politik";"scheiternder Staat";"";"";"failing state";"";"";"État défaillant";"";"";"Stato debole";"";""
"Diplomatie und Protokoll; Entwicklung und Zusammenarbeit; Politik";"gescheiterter Staat";"";"";"failed state";"";"";"État failli";"";"";"Stato fallito";"";""
"Entwicklung und Zusammenarbeit; Frieden und Sicherheit; Politik";"Staatsaufbau";"Staatsbildung";"";"state-building";"";"";"construction de l'État";"renforcement de l'État";"";"costruzione dello Stato";"organizzazione dello Stato";""
"Politik";"Staatsaufbau";"";"";"state structure";"";"";"structure de l'État";"";"";"struttura statale";"";""
"Energie und Umwelt; Landwirtschaft und Ernährung";"Agrarökologie";"";"";"agroecology";"";"";"agroécologie";"";"";"agroecologia";"";""
"Entwicklung und Zusammenarbeit; Politik";"Nationsbildung";"";"";"nation-building";"";"";"construction de la nation";"construction nationale";"édification nationale";"nation building";"processo di (ri)costruzione di un ordinamento statuale e democratico";""
"Energie und Umwelt; Entwicklung und Zusammenarbeit; Politik; Struktur und Institution";"freiwillige Länderprüfung";"";"";"";"voluntary national review";"";"";"examen national volontaire";"";"revisione nazionale volontaria";"";""
"Recht";"ius soli";"";"";"birthright citizenship";"ius soli";"jus soli";"droit du sol";"jus soli";"";"ius soli";"";""
"Recht";"Rechtshilfesystem";"";"";"legal aid system";"";"";"système d’assistance juridique";"";"";"sistema di assistenza giuridica";"";""
"Entwicklung und Zusammenarbeit; Menschenrechte; Politik";"Bürgerbeteiligung";"Bürgerpartizipation";"";"citizen engagement";"citizen participation";"civic engagement";"engagement citoyen";"engagement civique";"participation citoyenne";"impegno civico";"partecipazione dei cittadini";""
"Entwicklung und Zusammenarbeit; Gesundheit";"Allgemeinmedizin";"Familienmedizin";"Hausarztmedizin";"family medicine";"general practice";"";"médecine de famille";"médecine générale";"";"medicina di base";"medicina di famiglia";""
"Energie und Umwelt; Entwicklung und Zusammenarbeit; Landwirtschaft und Ernährung";"nachhaltige Weidebewirtschaftung";"nachhaltige Weidenutzung";"";"sustainable pasture management";"";"";"exploitation durable des pâturages";"gestion durable des pâturages";"";"gestione sostenibile dei pascoli";"";""
"Gender; Recht";"Femizid";"Frauenmord";"";"femicide";"";"";"féminicide";"";"";"femminicidio";"";""
"Informatik und Telekommunikation; Konsularische Angelegenheiten";"Erfassungsstation";"";"";"enrolment station";"";"";"poste de saisie";"";"";"postazione di rilevamento";"";""
"Migration";"";"Einreise-/Ausreisesystem";"";"";"entry/exit system";"";"";"système d'entrée/de sortie";"";"";"sistema di ingressi/uscite";""
"Entwicklung und Zusammenarbeit";"";"Europäischer Fonds für Südosteuropa";"";"";"European Fund for Southeast Europe";"";"";"fonds européen pour l'Europe du Sud-Est";"";"";"Fondo europeo per l’Europa sudorientale";""
"Beschaffungswesen";"Beschaffungskompetenz";"";"";"procurement authority";"";"";"compétence d'acquisition";"";"";"competenza in materia di acquisti";"";""
"Beschaffungswesen";"Preisprüfung";"";"";"price audit";"";"";"audit du prix";"";"";"verifica del prezzo";"";""
"Recht";"Zugang zur Justiz";"Zugang zur Rechtspflege";"";"access to justice";"";"";"accès à la justice";"";"";"accesso alla giustizia";"";""
"Konsularische Angelegenheiten; Recht";"Hilfsfonds Schweizer Staatsangehörige im Ausland";"";"";"Support Fund for Swiss Nationals Abroad";"";"";"Fonds d'aide aux ressortissants suisses à l'étranger";"";"";"Fondo di aiuto per i cittadini svizzeri all'estero";"";""
"HR";"Kuriererleichterung";"";"";"courier facilities";"";"";"facilités en matière de courrier";"";"";"facilitazione relativa al corriere";"";""
"HR";"Privatübermittlung";"";"";"";"";"";"acheminement de courrier privé";"";"";"invio privato";"";""
"Wirtschaft und Finanzen";"Kaufkraftparität";"";"";"purchasing power parity";"";"";"parité de pouvoir d'achat";"";"";"parità del potere d'acquisto";"";""
"Recht; Sicherheit";"Fingerabdruckdaten";"";"";"fingerprint data";"";"";"données dactyloscopiques";"";"";"dati relativi alle impronte digitali";"";""
"Recht; Sicherheit";"";"automatisiertes daktyloskopisches Identifizierungssystem";"automatisiertes Fingerabdruck-Identifizierungssystem";"automated dactyloscopic identification system";"automated fingerprint identification system";"";"système automatisé d'identification dactyloscopique";"système automatisé d'identification par empreintes digitales";"";"";"sistema automatizzato di identificazione dattiloscopica";"sistema automatizzato di identificazione delle impronte digitali"
"Recht; Sicherheit";"Treffer/Kein-Treffer-Verfahren";"";"";"hit/no hit system";"";"";"système de concordance/non-concordance";"";"";"sistema di riscontro positivo o negativo";"";""
"Recht; Sicherheit";"Grenzbehörde";"";"";"border authority";"";"";"autorité frontalière";"";"";"autorità di frontiera";"";""
"Recht; Sicherheit";"ETIAS-Zentralstelle";"";"";"ETIAS Central Unit";"";"";"unité centrale ETIAS";"";"";"unità centrale ETIAS";"";""
"Recht; Sicherheit";"nationale ETIAS-Stelle";"";"";"ETIAS National Unit";"";"";"unité nationale ETIAS";"";"";"unità nazionale ETIAS";"";""
"Recht; Sicherheit";"ETIAS-Überprüfungsausschuss";"";"";"ETIAS Screening Board";"";"";"comité d'examen ETIAS";"";"";"Commissione di esame ETIAS";"";""
"Recht; Sicherheit";"ETIAS-Beratungsgremium für Grundrechte";"";"";"ETIAS Fundamental Rights Guidance Board";"";"";"Comité d’orientation ETIAS sur les droits fondamentaux";"";"";"Commissione di orientamento sui diritti fondamentali dell’ETIAS";"";""
"Frieden und Sicherheit";"militärischer Endnutzer";"militärischer Endverwender";"";"military end user";"";"";"utilisateur final militaire";"";"";"utilizzatore finale militare";"";""
"Informatik und Telekommunikation; Menschenrechte";"Internetüberwachung";"";"";"internet surveillance";"";"";"surveillance d'Internet";"";"";"sorveglianza di Internet";"";""
"Sicherheit; Struktur und Institution";"Sektion Krisenmanagement";"";"";"Crisis Management";"";"";"Gestion des crises";"";"";"Sezione Gestione delle crisi";"";""
"Energie und Umwelt";"graue Energie";"";"";"grey energy";"";"";"énergie grise";"";"";"energia grigia";"";""
"Energie und Umwelt; Wirtschaft und Finanzen";"Halbfabrikat";"";"";"semi-finished good";"semi-finished product";"";"produit semi-fini";"";"";"prodotto semilavorato";"";""
"Recht";"materielles Recht";"";"";"substantive law";"";"";"droit matériel";"";"";"diritto sostanziale";"";""
"Beschaffungswesen";"Voranalyse";"";"";"needs analysis";"preliminary analysis";"";"analyse préalable";"";"";"analisi preliminare";"";""
"Politik; Wirtschaft und Finanzen";"Börsenäquivalenz";"";"";"stock exchange equivalence";"stock market equivalence";"";"équivalence boursière";"";"";"equivalenza borsistica";"equivalenza delle borse";""
"Politik; Wirtschaft und Finanzen";"finanzielle Gleichwertigkeit";"";"";"financial equivalence";"";"";"équivalence financière";"";"";"equivalenza finanziaria";"";""
"Entwicklung und Zusammenarbeit; Struktur und Institution";"Treuhandfonds der Weltbank";"";"";"World Bank trust fund";"";"";"fonds d'affectation spéciale de la Banque mondiale";"";"";"fondo fiduciario della Banca Mondiale";"";""
"Diplomatie und Protokoll; Konsularische Angelegenheiten";"Höflichkeitsfrist";"";"";"courtesy period";"";"";"délai de courtoisie";"";"";"termine di cortesia";"";""
"Energie und Umwelt";"Umweltzerstörung";"";"";"destruction of the environment";"ecocide";"environmental destruction";"destruction de l’environnement";"";"";"degrado ambientale";"degrado dell'ambiente";"distruzione dell'ambiente"
"Entwicklung und Zusammenarbeit; Politik; Struktur und Institution";"";"Kompetenzzentrum Engagement mit dem Privatsektor";"Kompetenzzentrum für das Engagement mit dem Privatsektor";"";"Competence Centre for Engagement with the Private Sector";"";"Centre de compétence pour l'engagement avec le secteur privé";"";"";"Centro di competenza per la collaborazione con il settore privato";"";""
"Diplomatie und Protokoll; Verkehr";"Luftverkehrsabkommen";"";"";"air service agreement";"air transport agreement";"";"accord relatif aux services aériens";"";"";"accordo in materia di servizi aerei";"accordo sui trasporti aerei";""
"Struktur und Institution";"Beobachtungsverfahren durch Peer-Evaluation";"";"";"peer monitoring mechanism";"";"";"mécanisme de suivi par les pairs";"";"";"meccanismo di monitoraggio tra pari";"";""
"Struktur und Institution";"Mechanismus zur Überprüfung der Durchführung des Übereinkommens der Vereinten Nationen gegen Korruption";"";"";"mechanism for the review of implementation of the United Nations Convention against Corruption";"";"";"mécanisme d’examen de l’application de la Convention des Nations Unies contre la corruption";"";"";"meccanismo d'esame dell'applicazione della Convenzione delle Nazioni Unite contro la corruzione";"";""
"Energie und Umwelt";"";"Globales Rahmenwerk für Klimadienstleistungen";"";"";"Global Framework for Climate Services";"";"Cadre mondial pour les services climatologiques";"";"";"";"Quadro globale per i servizi climatici";""
"Energie und Umwelt";"IG3IS";"Integriertes globales Treibhausgas-Informationssystem";"";"IG3IS";"Integrated Global Greenhouse Gas Information System";"";"IG3IS";"système mondial intégré d'information sur les gaz à effet de serre";"";"IG3IS";"sistema informativo integrato globale sui gas a effetto serra";""
"Entwicklung und Zusammenarbeit";"Swiss Investment Fund for Emerging Markets";"";"";"Swiss Investment Fund for Emerging Markets";"";"";"";"";"";"Swiss Investment Fund for Emerging Markets";"";""
"Frieden und Sicherheit; Struktur und Institution";"Organisation der Vereinten Nationen zur Überwachung des Waffenstillstands";"";"";"United Nations Truce Supervision Organization";"";"";"";"Organisme des Nations unies chargé de la surveillance de la trêve";"";"Organizzazione delle Nazioni Unite per la supervisione della tregua";"organizzazione delle Nazioni Unite per la sorveglianza dell'armistizio";""
"Konsularische Angelegenheiten; Recht";"Nachlassabwicklung";"Nachlassverfahren";"";"estate settlement";"";"";"procédure successorale";"règlement de succession";"";"procedimento successorio";"";""
"HR";"Profile und Gewinnung";"";"";"Profiles and Recruitment";"";"";"Profils et recrutement";"";"";"Profili e reclutamento";"";""
"Politik; Recht";"InstA";"institutionelles Abkommen";"";"InstA";"institutional agreement";"";"accord institutionnel";"";"";"accordo istituzionale";"";""
"Struktur und Institution";"gemischter parlamentarischer Ausschuss";"";"";"joint parliamentary committee";"";"";"comité parlementaire mixte";"";"";"comitato parlamentare misto";"";""
"Recht; Struktur und Institution";"horizontaler Gemischter Ausschuss";"";"";"horizontal joint committee";"";"";"comité mixte horizontal";"";"";"comitato misto orizzontale";"";""
"Struktur und Institution";"EFTA-Überwachungsbehörde";"";"";"EFTA Surveillance Authority";"";"";"Autorité de surveillance AELE";"";"";"Autorità di vigilanza AELS (EFTA)";"";""
"Recht; Wirtschaft und Finanzen";"Europäisches Wettbewerbsnetz";"";"";"European Competition Network";"";"";"réseau européen de la concurrence";"";"";"rete europea della concorrenza";"";""
"Recht; Struktur und Institution";"Binnenmarkt-Informationssystem";"";"";"";"Internal Market Information System";"";"";"système d'information du marché intérieur";"";"";"sistema di informazione del mercato interno";""
"Arbeit und Beschäftigung";"Entsendung von Arbeitnehmern";"";"";"posting of workers";"";"";"détachement de travailleurs";"";"";"distacco dei lavoratori";"";""
"Arbeit und Beschäftigung";"entsandter Arbeitnehmer";"Entsendung von Arbeitnehmern";"";"posted worker";"posting of workers";"";"détachement de travailleurs";"travailleur détaché";"";"distacco dei lavoratori";"lavoratore distaccato";""
"Struktur und Institution";"sektorieller Ausschuss";"";"";"sectoral committee";"";"";"comité sectoriel";"";"";"comitato settoriale";"";""
"Arbeit und Beschäftigung";"Grundsatz «gleicher Lohn für gleichwertige Arbeit»";"";"";"principle of equal pay for equal work or work of equal value";"";"";"principe « à travail égal, salaire égal »";"";"";"principio «a lavoro uguale, salario uguale»";"principio «salario uguale per un lavoro di uguale valore»";""
"Arbeit und Beschäftigung; Recht";"Bundesgesetz über die flankierenden Massnahmen bei entsandten Arbeitnehmerinnen und Arbeitnehmern und über die Kontrolle der in Normalarbeitsverträgen vorgesehenen Mindestlöhne";"Entsendegesetz";"EntsG";"Posted Workers Act";"";"";"LDét";"loi sur les travailleurs détachés";"";"LDist";"legge federale concernente le misure collaterali per i lavoratori distaccati e il controllo dei salari minimi previsti nei contratti normali di lavoro";"legge sui lavoratori distaccati"
"Frieden und Sicherheit";"Strategie der Schweiz zur Terrorismusbekämpfung";"";"";"counterterrorism strategy for Switzerland";"";"";"stratégie de la Suisse pour la lutte antiterroriste";"";"";"Strategia della Svizzera per la lotta al terrorismo";"";""
"Arbeit und Beschäftigung";"";"";"";"";"European Employment Services";"";"";"";"";"";"";""
"Arbeit und Beschäftigung";"Leiharbeit";"";"";"temporary agency work";"";"";"mise à disposition de travailleurs à titre principal";"travail en régie";"";"lavoro a prestito";"";""
"HR";"Informationssystem Personaldatenmanagement";"";"";"staff data management system";"";"";"";"système d'information pour la gestion des données du personnel";"";"";"sistema d'informazione per la gestione dei dati del personale";""
"Arbeit und Beschäftigung";"Leiharbeitsunternehmen";"";"";"placement agency";"temporary employment agency";"temporary employment undertaking";"entreprise de travail intérimaire";"";"";"impresa di lavoro interinale";"impresa di lavoro temporaneo";""
"Recht";"nach Billigkeit entscheiden";"";"";"decide as amiable compositeur";"decide as amiable compositor";"";"statuer en qualité d'amiable compositeur";"";"";"decidere in qualità di compositore amichevole";"";""
"Andere";"Bosniake";"";"";"Bosniak";"";"";"Bosniaque";"";"";"Bosgnacco";"";""
"Arbeit und Beschäftigung; Recht";"Tarifvertrag";"";"";"collective agreement";"";"";"convention collective";"";"";"contratto collettivo";"";""
"Andere";"Bosnier";"";"";"Bosnian";"";"";"Bosnien";"";"";"Bosnìaco";"";""
"Arbeit und Beschäftigung; Recht";"Schiedsspruch";"";"";"arbitration award";"";"";"sentence arbitrale";"";"";"arbitrato dichiarato";"decisione del tribunale arbitrale";""
"Entwicklung und Zusammenarbeit; Struktur und Institution; Wirtschaft und Finanzen";"";"Südafrikanische Zollunion";"Zollunion des südlichen Afrikas";"";"Southern African Customs Union";"";"";"Union douanière d'Afrique australe";"";"";"Unione doganale dell'Africa australe";""
"Politik; Struktur und Institution";"fial";"Foederation der Schweizerischen Nahrungsmittel-Industrien";"";"Federation of Swiss Food Industries";"";"";"Fédération des industries alimentaires suisses";"fial";"";"Federazione delle Industrie Alimentari Svizzere";"fial";""
"Politik";"Marktzugangsabkommen";"";"";"market access agreement";"";"";"accord d'accès au marché";"";"";"accordo di accesso al mercato";"";""
"Energie und Umwelt; Entwicklung und Zusammenarbeit";"nachhaltige Mobilität";"umweltverträgliche Mobilität";"";"sustainable mobility";"";"";"mobilité durable";"";"";"mobilità sostenibile";"";""
"Recht";"Verfahrensrecht";"";"";"procedural law";"";"";"droit de procédure";"droit procédural";"";"diritto procedurale";"";""
"Recht";"Rechtswahl";"";"";"choice of law";"";"";"choix de la loi applicable";"";"";"scelta della legislazione";"";""
